"","Paper","DOI.x","Year","LCS","GCS","Title","Authors","Corporate.Authors","Editors","Book.Editors","Source.Title","Publication.Date","Publication.Year","Volume","Issue","Part.Number","Supplement","Special.Issue","Beginning.Page","Ending.Page","Article.Number","DOI.y","Conference.Title","Conference.Date","Total.Citations","Average.per.Year","X1985","X1986","X1987","X1988","X1989","X1990","X1991","X1992","X1993","X1994","X1995","X1996","X1997","X1998","X1999","X2000","X2001","X2002","X2003","X2004","X2005","X2006","X2007","X2008","X2009","X2010","X2011","X2012","X2013","X2014","X2015","X2016","X2017","X2018","X2019","X2020","PT","AU","AF","SO","LA","DT","DE","ID","AB","C1","RP","EM","FU","FX","CR","NR","TC","Z9","U1","U2","PU","PI","PA","SN","EI","J9","JI","DI","EA","PG","WC","SC","GA","UT","DA","ER","PD","PY","VL","IS","BP","EP","OA","AR","OI","RI","SI","CT","CY","CL","SP","SU","BE","SE","BN","PN","GP","HO","DB","AU_UN","AU1_UN","AU_UN_NR","SR_FULL"
"38","DAS T, 2019, INT J SOC ECON","10.1108/IJSE-12-2017-0592",2019,1,3,"Does Credit Access Lead To Expansion Of Income And Multidimensional Poverty? A Study Of Rural Assam","Das, Tiken",NA,NA,"","INTERNATIONAL JOURNAL OF SOCIAL ECONOMICS","FEB 11 2019",2019,46,"2","",NA,"","252","270","","10.1108/IJSE-12-2017-0592","","",3,1.5,0,0,0,0,0,0,0,0,0,0,0,0,0,0,0,0,0,0,0,0,0,0,0,0,0,0,0,0,0,0,0,0,0,0,2,1,"J","DAS T","DAS, TIKEN","INTERNATIONAL JOURNAL OF SOCIAL ECONOMICS","ENGLISH","ARTICLE","RURAL CREDIT; HECKIT PROCEDURE; INCOME POVERTY; MULTIDIMENSIONAL POVERTY; TOBIT SELECTION EQUATION","ECONOMIC-GROWTH; FINANCIAL DEVELOPMENT; IMPACT; MICROFINANCE","PURPOSE THE PURPOSE OF THIS PAPER IS TO EVALUATE THE IMPACT OF CREDIT ACCESS ON INCOME AND MULTIDIMENSIONAL POVERTY BY PROVIDING AN ECONOMETRIC FRAMEWORK. DESIGN/METHODOLOGY/APPROACH THE STUDY IS CONDUCTED IN ASSAM, INDIA AND USES A QUASI-EXPERIMENT DESIGN TO GATHER PRIMARY DATA. ECONOMETRIC TOOLS LIKE HECKIT PROCEDURE, TOBIT SELECTION EQUATION AND PROBIT MODEL ARE USED FOR EMPIRICAL PURPOSE. FINDINGS THE PAPER FINDS THAT THE LEVEL OF INDIVIDUAL WELFARE IS INFLUENCED BY EQUIVALENT FACTORS. IN ADDITION, THE STUDY OBSERVES A LARGER INCIDENCE OF POVERTY AMONG TREATMENT HOUSEHOLDS OF SEMIFORMAL AND INFORMAL BORROWERS. THE STUDY ARGUES THAT FORMAL SOURCES ARE MORE EFFECTIVE IN REDUCING THE NUMBER OF POOR HOUSEHOLDS BY LIFTING THOSE WHO ARE CLOSEST TO THE POVERTY LINE. RESEARCH LIMITATIONS/IMPLICATIONS THE STUDY INDICATES A VICIOUS CIRCLE OF INCOME AND MULTIDIMENSIONAL POVERTY AMONG SEMIFORMAL AND INFORMAL BORROWERS. BY TRADITION, AS RURAL ASSAM GETS A DOMINANT ROLE OF TRADITIONAL COMMUNITY-BASED FINANCIAL INSTITUTIONS, WE SHOULD DEVELOP THE BANKING STRUCTURE BY INVOLVING THESE INSTITUTIONS. THE STUDY EXCLUDES OTHER PROBABLE EXPLANATORY VARIABLES WHILE EVALUATING THE IMPACT OF CREDIT ACCESS ON INCOME AND MULTIDIMENSIONAL POVERTY, AND THIS LIMITATION IS LEFT TO FUTURE RESEARCH. ORIGINALITY/VALUE THIS IS PROBABLY THE FIRST EMPIRICAL PAPER IN ASSAM SHOWING THE IMPACT OF CREDIT ACCESS ON MULTIDIMENSIONAL POVERTY BY ADJUSTING FOR ENDOGENEITY AND SELECTION BIAS.","[DAS, TIKEN] INDIAN INST PUBL HLTH, SHILLONG, MEGHALAYA, INDIA.","DAS, T (REPRINT AUTHOR), INDIAN INST PUBL HLTH, SHILLONG, MEGHALAYA, INDIA.","TIKENHYD@GMAIL.COM",NA,NA,"ARESTISA P, 2010, APPL FINANCIAL EC, V20, P1479; BANERJEE A, 2015, AM ECON J-APPL ECON, V7, P22, DOI 10.1257/APP.20130533; BATEMAN M., 2009, MICROFINANCE ILLUSIO; BLAYLOCK JR, 1991, WESTERN J AGR ECON, V16, P11; BORAH M., 2016, 34 IARIW GEN C DRESD; BRUHN M, 2014, J FINANC, V69, P1347, DOI 10.1111/JOFI.12091; COLEMAN BE, 1999, J DEV ECON, V60, P105, DOI 10.1016/S0304-3878(99)00038-3; COPESTAKE J., 2005, DEVELOPMENT POLICY REVIEW, V23, P703, DOI 10.1111/J.1467-7679.2005.00309.X; CREPON B, 2015, AM ECON J-APPL ECON, V7, P123, DOI 10.1257/APP.20130535; DAS D., 2011, INFORMAL MICROFINANC; DAS T., 2015, J EC POLICY RES, V10, P189; DAS T, 2018, INT J SOC ECON, V45, P1142, DOI 10.1108/IJSE-03-2017-0081; DEMIRGUC-KUNT A, 2009, ANNU REV FINANC ECON, V1, P287, DOI 10.1146/ANNUREV.FINANCIAL.050808.114334; DICHTER T., 2005, HYPE HOPE WORRISOME; GALE F., 2006, WRS0601 USDA EC RES; GARNER T.I., 2002, 357 BLS US DEP INT; GRAVESTEIJN R., 2015, EFFECTS MICROCREDIT; HARTARSKA V, 2015, AGRIC FINANCE REV, V75, P302, DOI 10.1108/AFR-04-2015-0018; HECKMAN JJ, 1979, ECONOMETRICA, V47, P153, DOI 10.2307/1912352; HULME D., 1996, FINANCE POVERTY; IMAI K., 2008, EC DISCUSSION PAPER, V0814; KARLAN D, 2010, REV FINANC STUD, V23, P433, DOI 10.1093/RFS/HHP092; KENDALL J, 2012, J BANK FINANC, V36, P1548, DOI 10.1016/J.JBANKFIN.2012.01.001; KHAKI AR, 2017, INT J SOC ECON, V44, P1032, DOI 10.1108/IJSE-10-2015-0277; KHANDKER S.R., 2013, 6404 WORLD BANK; KHANDKER SK, 1998, FIGHTING POVERTY MIC; KHANDKER SR, 2005, WORLD BANK ECON REV, V19, P263, DOI 10.1093/WBER/LHI008; KHANDKER SR, 2003, AGR ECON, V28, P197, DOI 10.1016/S0169-5150(03)00017-3; KHANDKER SR, 2003, 2945 WORLD BANK; KRUEGER D, 2006, REV ECON STUD, V73, P163, DOI 10.1111/J.1467-937X.2006.00373.X; MORDUCH JONATHAN, 2002, 1014 NEW YORK U; PATRICK HT, 1966, ECON DEV CULT CHANGE, V14, P174, DOI 10.1086/450153; RANGARAJAN C., 2008, REPORT COMMITTEE FIN; RAVALLION M, 1988, ECON J, V98, P1171, DOI 10.2307/2233725; ROBINSON M, 2001, MICROFINANCE REVOLUT; ROTHBARTH E., 1943, WAR TIME PATTERN SAV, P1255; SEHRAWAT M, 2016, INT J EMERG MARK, V11, P569, DOI 10.1108/IJOEM-11-2014-0172; SHARMA A., 2009, 21 MICROSAVE IND; SHARMA A., 2011, EXPLORATORY STUDY TR; SINGH E.N., 2011, MANAGEMENT CONVERGEN, V2, P10; SINGH W.C., 2009, INT REV BUSINESS RES, V5, P160; SLBC, 2014, Q REP BRANCH NETW AS; STIGLITZ JE, 1981, AM ECON REV, V71, P393; TIKEN DAS, 2015, JOURNAL OF RURAL DEVELOPMENT (HYDERABAD), V34, P17; VON PISCHKE J.D., 1991, FINANCE FRONTIER DEB; WAGSTAFF A., 1998, J HLTH EC, V16, P93; WOOD G., 1997, CREDIT CREDIT IS DUE; ZARAZUA M.N., 2007, 2367 MPRA","48",3,"3","1","6","EMERALD GROUP PUBLISHING LTD","BINGLEY","HOWARD HOUSE, WAGON LANE, BINGLEY BD16 1WA, W YORKSHIRE, ENGLAND","0306-8293","1758-6712","INT J SOC ECON","INT. J. SOC. ECON.","10.1108/IJSE-12-2017-0592",NA,"19","ECONOMICS","BUSINESS & ECONOMICS","HH7LG","ISI000455911700007","2020-02-17","","FEB 11",2019,"46","2","252","270",NA,NA,NA,NA,NA,NA,NA,NA,NA,NA,NA,NA,NA,NA,NA,NA,"ISI","INDIAN INST PUBL HLTH","INDIAN INST PUBL HLTH",NA,"DAS T, 2019, INT J SOC ECON"
"39","DIGIUSEPPE M, 2016, ECON POLIT-OXFORD","10.1111/ECPO.12081",2016,0,9,"Borrowed Time: Sovereign Finance, Regime Type, And Leader Survival","DiGiuseppe, Matthew; Shea, Patrick E.",NA,NA,"","ECONOMICS & POLITICS","NOV 2016",2016,28,"3","",NA,"","342","367","","10.1111/ecpo.12081","","",9,1.8,0,0,0,0,0,0,0,0,0,0,0,0,0,0,0,0,0,0,0,0,0,0,0,0,0,0,0,0,0,0,0,0,1,5,2,1,"J","DIGIUSEPPE M;SHEA PE","DIGIUSEPPE, MATTHEW; SHEA, PATRICK E.","ECONOMICS & POLITICS","ENGLISH","ARTICLE",NA,"FOREIGN-AID; DEMOCRATIC ADVANTAGE; POLITICAL-ECONOMY; DEBT; INSTITUTIONS; COMMITMENT; RATINGS; CREDIT; GOVERNMENTS; FOUNDATIONS","THIS STUDY EXPLORES THE CONDITIONAL INFLUENCE OF SOVEREIGN CREDIT ON LEADER SURVIVAL. WE SPECIFICALLY FOCUS ON CREDIT'S HETEROGENEOUS EFFECT ON LEADERSHIP SURVIVAL ACROSS REGIMES. WE ARGUE THAT NON-DEMOCRATIC LEADERS ARE MORE SENSITIVE TO CREDIT ACCESS AND COST THAN DEMOCRATIC LEADERSHIP. WE USE EVENT HISTORY ANALYSIS TO TEST THE CONDITIONAL RELATIONSHIP BETWEEN SOVEREIGN CREDIT AND LEADER TENURE FROM 1981 TO 2004. EXAMINING BOTH DOMESTIC AND GLOBAL DETERMINANTS OF CREDIT ACCESS AND COSTS, OUR FINDINGS ARE CONSISTENT WITH THE ASSERTION THAT NON-DEMOCRATIC LEADERSHIP SURVIVAL IS LINKED TO CREDIT EVEN WHEN ADDRESSING ISSUES OF ENDOGENEITY.","[DIGIUSEPPE, MATTHEW] UNIV MISSISSIPPI, OXFORD, MS 38677 USA.; [SHEA, PATRICK E.] UNIV HOUSTON, HOUSTON, TX 77004 USA.","DIGIUSEPPE, M (REPRINT AUTHOR), UNIV MISSISSIPPI, DEPT POLIT SCI, OXFORD, MS 38677 USA.","MRDIGIUS@OLEMISS.EDU",NA,NA,"AHLQUIST JS, 2006, INT STUD QUART, V50, P681, DOI 10.1111/J.1468-2478.2006.00420.X; AHMED FZ, 2012, AM POLIT SCI REV, V106, P146, DOI 10.1017/S0003055411000475; ALLEN MA, 2013, INT STUD QUART, V57, P647, DOI 10.1111/ISQU.12010; ARCHER CC, 2007, INT ORGAN, V61, P341, DOI 10.1017/S0020818307070129; AXELROD R., 1984, EVOLUTION COOPERATIO; BANKS ARTHUR S., 2012, CROSS NATL TIME SERI; BANZHAF H., 2013, NATL TAX J, V66, P511, DOI DOI 10.17310/NTJ.2013.3.01; BARRO RJ, 1989, J ECON PERSPECT, V3, P37, DOI 10.1257/JEP.3.2.37; BEARCE DH, 2010, J POLIT, V72, P837, DOI 10.1017/S0022381610000204; BEAULIEU E., 2012, INT ORG, V66; BIGLAISER G, 2012, INT ORGAN, V66, P515, DOI 10.1017/S0020818312000185; BLAKE DJ, 2013, INT ORGAN, V67, P797, DOI 10.1017/S0020818313000258; BLOCK SA, 2004, J INT MONEY FINANC, V23, P917, DOI 10.1016/J.JIMONFIN.2004.05.001; BOX-STEFFENSMEIER J.M., 2004, EVENT HIST MODELING; BOX-STEFFENSMEIER JM, 2001, AM J POLIT SCI, V45, P972, DOI 10.2307/2669335; BROOKS SM, 2015, INT STUD QUART, V59, P587, DOI 10.1111/ISQU.12173; BUCHANAN JM, 1976, J POLIT ECON, V84, P337, DOI 10.1086/260436; CANTOR R, 1996, FRBNY EC POLICY REV, V2, P37; CHEIBUB JA, 1998, WORLD POLIT, V50, P349, DOI 10.1017/S0043887100012843; CHEIBUB JA, 2010, PUBLIC CHOICE, V143, P67, DOI 10.1007/S11127-009-9491-2; CHIOZZA G, 2004, AM J POLIT SCI, V48, P604; CLARK WR, 2013, INT STUD QUART, V57, P556, DOI 10.1111/ISQU.12013; CORNAGGIA J., 2014, WORKING PAPER; CRESPO-TENORIO A, 2014, COMP POLIT STUD, V47, P1047, DOI 10.1177/0010414013488559; CURTIS KA, 2014, INT ORGAN, V68, P721, DOI 10.1017/S0020818314000034; D'AMBROSIO MARY, 2005, I INVESTOR, V30, P143; DE MESQUITA BB, 2010, AM J POLIT SCI, V54, P936, DOI 10.1111/J.1540-5907.2010.00463.X; DIGIUSEPPE M, 2015, INT STUD QUART, V59, P557, DOI 10.1111/ISQU.12181; DIGIUSEPPE MR, 2012, J PEACE RES, V49, P391, DOI 10.1177/0022343311434239; EASTERLY W, 2002, WORLD DEV, V30, P1677, DOI 10.1016/S0305-750X(02)00073-6; EASTERLY W., 1999, IS FISCAL ADJUSTMENT; FRACASSI C., 2015, ARE CREDIT RAT UNPUB; FRIEDEN JEFFRY, 1991, DEBT DEV DEMOCRACY M; FUCHS A., 2013, DEP EC DISCUSSION PA, V552; GEDDES B., 1994, POLITICIANSS DILEMMA; GEDDES B, 2014, PERSPECT POLIT, V12, P313, DOI 10.1017/S1537592714000851; GOEMANS HE, 2008, J CONFLICT RESOLUT, V52, P771, DOI 10.1177/0022002708323316; GOEMANS HE, 2009, J PEACE RES, V46, P269, DOI 10.1177/0022343308100719; GRAY J, 2013, COMPANY STATES KEEP: INTERNATIONAL ECONOMIC ORGANIZATIONS AND INVESTOR PERCEPTIONS, P1, DOI 10.1017/CBO9781139344418; HAGGARD STEPHAN, 2008, DEV DEMOCRACY WELFAR; HANKLA CR, 2013, INT STUD QUART, V57, P492, DOI 10.1111/J.1468-2478.2012.00753.X; HOLLYER JR, 2012, INT STUD QUART, V56, P748, DOI 10.1111/J.1468-2478.2012.00750.X; JAYACHANDRAN S, 2006, AM ECON REV, V96, P82, DOI 10.1257/000282806776157696; KONO DY, 2009, J POLIT, V71, P704, DOI 10.1017/S0022381609090550; KRUEGER AO, 1974, AM ECON REV, V64, P291; LAI B, 2006, FOREIGN POL ANAL-US, V2, P385, DOI 10.1111/J.1743-8594.2006.00037.X; LEVI M., 1988, RULE REVENUE; LI Q, 2009, COMP POLIT STUD, V42, P1098, DOI 10.1177/0010414009331723; LICHT AA, 2010, J CONFLICT RESOLUT, V54, P58, DOI 10.1177/0022002709351104; MARSHALL M. G., 2010, INTERNAL WARS FAILUR; MCDONALD PJ, 2009, INVISIBLE HAND OF PEACE: CAPITALISM, THE WAR MACHINE, AND INTERNATIONAL RELATIONS THEORY, P1, DOI 10.1017/CBO9780511818301; MCDONALD PJ, 2011, INT STUD QUART, V55, P1095, DOI 10.1111/J.1468-2478.2011.00682.X; MCDONALD PJ, 2010, INT INTERACT, V36, P146, DOI 10.1080/03050621003784911; MCMILLAN M, 2001, REV ECON STAT, V83, P170, DOI 10.1162/003465301750160135; MESQUITA BB, 2003, LOGIC OF POLITICAL SURVIVAL, P1; MORRISON KM, 2009, INT ORGAN, V63, P107, DOI 10.1017/S0020818309090043; MOSLEY LAYNA, 2003, GLOBAL CAPITAL NATL; NDULU BJ, 1999, J ECON PERSPECT, V13, P41, DOI 10.1257/JEP.13.3.41; NORTH DC, 1989, J ECON HIST, V49, P803, DOI 10.1017/S0022050700009451; OATLEY T, 2011, INT ORGAN, V65, P311, DOI 10.1017/S002081831100004X; OATLEY T, 2010, INT STUD QUART, V54, P175, DOI 10.1111/J.1468-2478.2009.00582.X; ODONNELL GUILLERMO, 1994, J DEMOCR, V5, P55, DOI [10.1353/JOD.1994.0010, DOI 10.1353/JOD.1994.0010]; ODRISCOLL GP, 1977, J POLIT ECON, V85, P207, DOI 10.1086/260552; PALER L, 2013, AM POLIT SCI REV, V107, P706, DOI 10.1017/S0003055413000415; RASLER KA, 1985, AM POLIT SCI REV, V79, P491, DOI 10.2307/1956662; REGAN PM, 2009, CONFLICT MANAG PEACE, V26, P286, DOI 10.1177/0738894209104556; REINHART CM, 2009, THIS TIME IS DIFFERENT: EIGHT CENTURIES OF FINANCIAL FOLLY, P1; RICARDO D., 1951, WORKS CORRES FD RICA; RICCIUTI ROBERTO, 2003, EC B, V8, P1; ROMERO LUIS ALBERTO, 2002, HIST ARGENTINA 20 CE; ROSE AK, 2005, J DEV ECON, V77, P189, DOI 10.1016/J.JDEVECO.2004.03.006; ROSE AK, 2009, J DEV ECON, V89, P250, DOI 10.1016/J.JDEVECO.2008.04.005; ROSS MICHAEL L., 2013, OIL GAS DATA 1932 20; SAIEGH SM, 2009, ECON POLIT-OXFORD, V21, P232, DOI 10.1111/J.1468-0343.2009.00344.X; SCHEDLER ANDREAS, 2013, POLITICS UNCERTAINTY; SCHULTZ KA, 2003, INT ORGAN, V57, P3, DOI 10.1017/S0020818303571065; SCOTT GC, 1996, 140 INT MON FUND; SEATER JJ, 1993, J ECON LIT, V31, P142; SHEA PE, 2016, INT INTERACT, V42, P401, DOI 10.1080/03050629.2016.1100611; SHEA PE, 2014, J CONFLICT RESOLUT, V58, P771, DOI 10.1177/0022002713478567; SMITH A, 2008, J POLIT, V70, P780, DOI 10.1017/S0022381608080754; TOMZ M, 2013, ANNU REV ECON, V5, P247, DOI 10.1146/ANNUREV-ECONOMICS-061109-080443; TORRE J. C., 1993, ARGENTINA INDEPENDEN, P173; TSEBELIS G, 2004, EUR J POLIT RES, V43, P449, DOI 10.1111/J.1475-6765.2004.00161.X; TSEBELIS G., 2002, VETO PLAYERS POLITIC; VAN DESWALLE N., 2001, AFRICAN EC POLITICS; WAGNER RE, 1976, PUBLIC CHOICE, V25, P45, DOI 10.1007/BF01726330; WEEKS JL, 2012, AM POLIT SCI REV, V106, P326, DOI 10.1017/S0003055412000111; WILLIAMS LK, 2012, INT POLIT SCI REV, V33, P131, DOI 10.1177/0192512111399006; WINTROBE R., 1998, POLITICAL EC DICTATO; WORLD BANK GROUP, 2012, WORLD DEV IND 2012; WRIGHT J, 2008, COMP POLIT STUD, V41, P971, DOI 10.1177/0010414007308538; WRIGHT J, 2009, AM J POLIT SCI, V53, P552, DOI 10.1111/J.1540-5907.2009.00386.X","93",9,"9","0","8","WILEY PERIODICALS, INC","SAN FRANCISCO","ONE MONTGOMERY ST, SUITE 1200, SAN FRANCISCO, CA 94104 USA","0954-1985","1468-0343","ECON POLIT-OXFORD","ECON. POLIT.","10.1111/ECPO.12081",NA,"26","ECONOMICS; POLITICAL SCIENCE","BUSINESS & ECONOMICS; GOVERNMENT & LAW","DY8WB","ISI000385411400005","2020-02-17","","NOV",2016,"28","3","342","367",NA,NA,"DIGIUSEPPE, MATTHEW/0000-0003-0823-0436",NA,NA,NA,NA,NA,NA,NA,NA,NA,NA,NA,NA,NA,"ISI","UNIV MISSISSIPPI;UNIV HOUSTON","UNIV MISSISSIPPI",NA,"DIGIUSEPPE M, 2016, ECON POLIT-OXFORD"
"40","DRAKOS K, 2011, J INT MONEY FINANC","10.1016/J.JIMONFIN.2011.09.004",2011,5,17,"On The Determinants Of Credit Rationing: Firm-Level Evidence From Transition Countries","Drakos, Konstantinos; Giannakopoulos, Nicholas",NA,NA,"","JOURNAL OF INTERNATIONAL MONEY AND FINANCE","DEC 2011",2011,30,"8","",NA,"","1773","1790","","10.1016/j.jimonfin.2011.09.004","","",17,1.7,0,0,0,0,0,0,0,0,0,0,0,0,0,0,0,0,0,0,0,0,0,0,0,0,0,0,0,0,0,2,2,5,2,2,3,1,"J","DRAKOS K;GIANNAKOPOULOS N","DRAKOS, KONSTANTINOS; GIANNAKOPOULOS, NICHOLAS","JOURNAL OF INTERNATIONAL MONEY AND FINANCE","ENGLISH","ARTICLE","BIVARIATE PROBIT; CENSORING; CREDIT RATIONING; TRANSITION","RESEARCH-AND-DEVELOPMENT; IMPERFECT INFORMATION; SMALL-BUSINESS; SAMPLE SELECTION; MONETARY-POLICY; INVESTMENT; MARKETS; AVAILABILITY; GROWTH; DISCRIMINATION","USING SURVEY DATA FOR FIRMS FROM EASTERN EUROPEAN TRANSITION ECONOMIES WE INVESTIGATE THE DETERMINANTS OF CREDIT RATIONING. OUR RATIONING DEFINITION INCORPORATES FIRMS WHOSE LOAN APPLICATION WAS REJECTED, BUT ALSO 'DISCOURAGED' POTENTIAL BORROWERS. WE EMPLOY A BIVARIATE PROBIT WITH CENSORING, APPROACH THAT ACCOUNTS FOR THE UNDERLYING SELECTIVITY SINCE RATIONED FIRMS ARE A SUBSET OF THOSE WITHOUT A LOAN. WE INCLUDE FIRM-SPECIFIC ATTRIBUTES RELATED TO THE ALLEVIATION OF INFORMATIONAL ASYMMETRIES, AND THEREFORE EXPECTED TO AFFECT CREDIT RATIONING. WE FIND THAT CREDIT RATIONING DEPENDS ON FIRM SIZE, PROFITABILITY, SALES GROWTH, OWNERSHIP TYPE, LEGAL STATUS, SECTORAL HETEROGENEITY AND THE COUNTRY-SPECIFIC LEVEL OF DOMESTIC CREDIT. (C) 2011 ELSEVIER LTD. ALL RIGHTS RESERVED.","[DRAKOS, KONSTANTINOS] ATHENS UNIV ECON & BUSINESS, DEPT ACCOUNTING & FINANCE, ATHENS 10434, GREECE.; [GIANNAKOPOULOS, NICHOLAS] UNIV PATRAS, DEPT ECON, PATRAS 26504, GREECE.","DRAKOS, K (REPRINT AUTHOR), ATHENS UNIV ECON & BUSINESS, DEPT ACCOUNTING & FINANCE, 76 PATISS ST, ATHENS 10434, GREECE.","KDRAKOS@AUEB.GR; NGIAS@UPATRAS.GR",NA,NA,"AGHION P, 1992, REV ECON STUD, V59, P473, DOI 10.2307/2297860; ALLEN L., 1987, CREDIT RATIONING PHE; ANGELINI P, 1998, J BANK FINANC, V22, P925, DOI 10.1016/S0378-4266(98)00008-9; AUDRETSCH DB, 2002, INT J IND ORGAN, V20, P1, DOI 10.1016/S0167-7187(00)00072-2; BECK T, 2002, J FINANC ECON, V64, P147, DOI 10.1016/S0304-405X(02)00074-0; BECKER G., 1971, EC DISCRIMINATION; BERGER AN, 1995, J BUS, V68, P351, DOI 10.1086/296668; BERNANKE B, 1990, Q J ECON, V105, P97; BERNANKE BS, 1995, J ECON PERSPECT, V9, P27, DOI 10.1257/JEP.9.4.27; BESANKO D, 1987, INT ECON REV, V28, P671, DOI 10.2307/2526573; BESTER H, 1985, AM ECON REV, V75, P850; BESTER H, 1987, EUR ECON REV, V31, P887, DOI 10.1016/0014-2921(87)90005-5; BIGNEBAT C., 2005, WHICH FIRMS HAVE SOF; BLANCHFLOWER DG, 2003, REV ECON STAT, V85, P930, DOI 10.1162/003465303772815835; BOOCOCK G, 1997, INT SMALL BUS J, V16, P36, DOI DOI 10.1177/0266242697161003; BOPAIAH C, 1998, SMALL BUS ECON, V11, P75, DOI 10.1023/A:1007944811224; BOYES WJ, 1989, J ECONOMETRICS, V40, P3, DOI 10.1016/0304-4076(89)90026-2; CARPENTER RE, 2002, ECON J, V112, P54, DOI DOI 10.1111/1468-0297.00683; CARRINGTON C., 2006, J SMALL BUSINESS ENT, V19, P83; CAVALLUZZO KS, 2002, J BUS, V75, P641, DOI 10.1086/341638; CHAKRAVARTY S, 1999, J BUS, V72, P523, DOI 10.1086/209626; CHAN YS, 1985, J MONEY CREDIT BANK, V17, P84, DOI 10.2307/1992508; CHAN YS, 1987, J FINANC, V42, P345, DOI 10.2307/2328256; CIAIAN P, 2004, POST-COMMUNIST ECON, V16, P39, DOI 10.1080/1463137042000194834; CLAESSENS S, 2006, CORP GOV, V14, P266, DOI 10.1111/J.1467-8683.2006.00506.X; COLE RA, 1998, J BANK FINANC, V22, P959, DOI 10.1016/S0378-4266(98)00007-7; COLEMAN S, 2000, J SMALL BUS MANAGE, V38, P37; COWLING M, 2003, SMALL BUS ECON, V21, P63, DOI 10.1023/A:1024408932156; COX D, 1990, REV ECON STAT, V72, P445, DOI 10.2307/2109352; CRESSY R, 1996, ECON J, V106, P1253, DOI 10.2307/2235519; CROOK J, 2001, APPL FINANCIAL EC, V11, P83, DOI DOI 10.1080/09603100150210291; DE MEZA D, 2006, ECONOMICA, V73, P563, DOI 10.1111/J.1468-0335.2006.00533.X; DHARAN B., 1993, J SMALL BUSINESS FIN, V2, P1; DIAMOND D, 1991, J POLITICAL EC, V99, P688; EGERER R., 1995, 1555 WORLD BANK; EROL T, 2005, J DEV ECON, V76, P503, DOI 10.1016/J.JDEVECO.2004.01.005; FAMA EF, 1983, J LAW ECON, V26, P301, DOI 10.1086/467037; FAZZARI SM, 1988, BROOKINGS PAPERS EC, V1, P141, DOI DOI 10.2307/2534426; FREEL MS, 2007, SMALL BUS ECON, V28, P23, DOI 10.1007/S11187-005-6058-6; GERTLER M, 1994, Q J ECON, V109, P309, DOI 10.2307/2118465; GERTLER M, 1988, J MONEY CREDIT BANK, V20, P559, DOI 10.2307/1992535; GILCHRIST S, 1995, J MONETARY ECON, V36, P541, DOI 10.1016/0304-3932(95)01223-0; GREENE W, 1998, JPN WORLD ECON, V10, P299, DOI 10.1016/S0922-1425(98)00030-9; GREENE W.H., 2003, ECONOMETRIC ANAL; GREENE WH, 2002, LIMDEP VERSION 8 ECO; GREENWALD B, 1984, AM ECON REV, V74, P194; GROS D., 2000, 56 EUR CENTR BANK; HARHOFF D, 1998, J IND ECON, V46, P453, DOI 10.1111/1467-6451.00083; HEISS F, 2004, EUROPEAN FINANCIAL M, V10, P167, DOI DOI 10.1111/J.1468-036X.2004.00244.X; HIMMELBERG CP, 1994, REV ECON STAT, V76, P38, DOI 10.2307/2109824; HU X., 1994, REV ECON STAT, V80, P466; HUBBARD G, 1998, J ECON LIT, V36, P193; JAFFEE D., 1990, HDB MONETARY EC, V2, P837, DOI DOI 10.1016/S1573-4498(05)80023-2; JAFFEE DM, 1976, Q J ECON, V90, P651, DOI 10.2307/1885327; JAPPELLI T, 1990, Q J ECON, V105, P219, DOI 10.2307/2937826; JENSEN J.B., 1997, IND CORP CHANGE, V6, P25; KON Y, 2003, SMALL BUS ECON, V21, P37, DOI 10.1023/A:1024447603600; LEVENSON AR, 2000, SMALL BUS ECON, V14, P83, DOI 10.1023/A:1008196002780; MICKIEWICZ T., 2004, 666 W DAV I; MIJID N., 2008, GENDER RACE CREDIT R; MUSHINSKI DW, 1999, J DEV STUD, V36, P88, DOI 10.1080/00220389908422622; OLINER SD, 1992, REV ECON STAT, V74, P643, DOI 10.2307/2109378; PETERSEN MA, 1994, J FINANC, V49, P3, DOI 10.2307/2329133; PETRICK M, 2004, FOOD POLICY, V29, P275, DOI 10.1016/J.FOODPOL.2004.05.002; PETRICK M, 2004, EUR REV AGRIC ECON, V31, P77, DOI 10.1093/ERAE/31.1.77; PIGA C, 2003, APPL ECON LETT, V10, P243, DOI 10.1080/1350485022000044156; PIGA C. A., 2007, B ECON RES, V59, P149, DOI DOI 10.1111/BOER.2007.59.ISSUE-2; PIGA CA, 2004, OXFORD B ECON STAT, V66, P457, DOI 10.1111/J.1468-0084.2004.00089.X; RAJAN RG, 1998, AM ECON REV, V88, P559; RILEY JG, 1987, AM ECON REV, V77, P224; SCHIANTARELLI F., 2000, EMPIRICA, V27, P175, DOI DOI 10.1023/A:1026588619191; STIGLITZ JE, 1985, J MONEY CREDIT BANK, V17, P133, DOI 10.2307/1992329; STIGLITZ JE, 1981, AM ECON REV, V71, P393; SYMEONIDIS G., 1996, 161 OECD WP EC DEP; TREICHEL MZ, 2006, VENTUR CAP, V8, P51, DOI 10.1080/13691060500453726; VAN DE VEN P.M.M., 1981, J ECONOMETRICS, V17, P229; VIJVERBERG CPC, 2004, J MACROECON, V26, P101, DOI 10.1016/J.JMACRO.2002.09.004; VONTHADDEN EL, 1990, KYKLOS, V43, P635","78",17,"17","0","13","ELSEVIER SCI LTD","OXFORD","THE BOULEVARD, LANGFORD LANE, KIDLINGTON, OXFORD OX5 1GB, OXON, ENGLAND","0261-5606",NA,"J INT MONEY FINANC","J. INT. MONEY FINAN.","10.1016/J.JIMONFIN.2011.09.004",NA,"18","BUSINESS, FINANCE","BUSINESS & ECONOMICS","868OX","ISI000298533700008","2020-02-17","","DEC",2011,"30","8","1773","1790",NA,NA,NA,NA,NA,NA,NA,NA,NA,NA,NA,NA,NA,NA,NA,NA,"ISI","ATHENS UNIV ECON AND BUSINESS;UNIV PATRAS","ATHENS UNIV ECON AND BUSINESS",NA,"DRAKOS K, 2011, J INT MONEY FINANC"
