"","Paper","DOI.x","Year","LCS","GCS","Title","Authors","Corporate.Authors","Editors","Book.Editors","Source.Title","Publication.Date","Publication.Year","Volume","Issue","Part.Number","Supplement","Special.Issue","Beginning.Page","Ending.Page","Article.Number","DOI.y","Conference.Title","Conference.Date","Total.Citations","Average.per.Year","X1985","X1986","X1987","X1988","X1989","X1990","X1991","X1992","X1993","X1994","X1995","X1996","X1997","X1998","X1999","X2000","X2001","X2002","X2003","X2004","X2005","X2006","X2007","X2008","X2009","X2010","X2011","X2012","X2013","X2014","X2015","X2016","X2017","X2018","X2019","X2020","PT","AU","AF","SO","LA","DT","DE","ID","AB","C1","RP","EM","FU","FX","CR","NR","TC","Z9","U1","U2","PU","PI","PA","SN","EI","J9","JI","DI","EA","PG","WC","SC","GA","UT","DA","ER","PD","PY","VL","IS","BP","EP","OA","AR","OI","RI","SI","CT","CY","CL","SP","SU","BE","SE","BN","PN","GP","HO","DB","AU_UN","AU1_UN","AU_UN_NR","SR_FULL"
"99","RAHMAN A, 2017, REV ECON PERSPECT","10.1515/REVECP-2017-0014",2017,0,4,"Determinants Of Sme Finance: Evidence From Three Central European Countries","Rahman, Ashiqur; Rahman, M. Twyeafur; Belas, Jaroslav",NA,NA,"","REVIEW OF ECONOMIC PERSPECTIVES","SEP 2017",2017,17,"3","",NA,"","263","285","","10.1515/revecp-2017-0014","","",4,1,0,0,0,0,0,0,0,0,0,0,0,0,0,0,0,0,0,0,0,0,0,0,0,0,0,0,0,0,0,0,0,0,0,3,1,0,"J","RAHMAN A;RAHMAN MT;BELAS J","RAHMAN, ASHIQUR; RAHMAN, M. TWYEAFUR; BELAS, JAROSLAV","REVIEW OF ECONOMIC PERSPECTIVES","ENGLISH","ARTICLE","ACCESS TO FINANCE; SMES; CZECH REPUBLIC; SLOVAK REPUBLIC; HUNGARY","SMALL BUSINESS; IMPERFECT INFORMATION; LENDING RELATIONSHIPS; BANK COMPETITION; INNOVATIVE SMES; CREDIT MARKETS; GENDER MATTER; ACCESS; FIRMS; RISK","THIS PAPER EXPLORES THE DETERMINANTS OF ACCESS TO FINANCE FOR SMALL AND MEDIUM ENTERPRISES (SMES) IN THE CONTEXT OF THREE CENTRAL EUROPEAN COUNTRIES: CZECH REPUBLIC, SLOVAK REPUBLIC, AND HUNGARY. THE DATA SET OF THE RESEARCH IS OBTAINED FROM THE BEEPS SURVEY, WHICH IS CONDUCTED BY THE WORLD BANK AND THE EUROPEAN BANK FOR RECONSTRUCTION AND DEVELOPMENT. THIS PAPER EMPIRICALLY ANALYSES FIRMS NOT ONLY FROM THE SMES POINT OF VIEW, BUT ALSO SHOWS RESULTS FOR MICRO, SMALL AND MEDIUM ENTERPRISES SEPARATELY. ADDITIONALLY, WE HAVE ANALYSED THE DETERMINANTS OF ACCESS TO FINANCE FOR SMES AT EACH COUNTRY LEVEL FOR AN IN-DEPTH UNDERSTANDING OF COUNTRY-LEVEL VARIATIONS IN SME FINANCING. THE RESULTS INDICATE THAT MICRO FIRMS AND FIRMS OWNED AND OPERATED BY WOMEN ARE EXPERIENCING A SHORTAGE OF CREDITS FROM BANKS. ON THE OTHER HAND, WE FOUND A POSITIVE RELATIONSHIP BETWEEN THE PLEDGE OF COLLATERAL AND ACCESS TO FINANCE. WITH RESPECT TO THE MEDIUM FIRMS, WE FOUND EVIDENCE THAT INNOVATIVE FIRMS HAVE A LARGER AMOUNT OF CREDIT FROM BANKS. THE EMPIRICAL RESULTS ALSO SUGGEST THAT THE LOAN SIZE INCREASES AS THE INTEREST RATES INCREASE IN PARTICULAR FOR SMES ON THE WHOLE AND FOR MICRO-FIRMS, ALTHOUGH THE INTEREST RATE IS IN A NEGATIVE RELATIONSHIP WITH THE LOAN SIZE IN CZECH REPUBLIC.","[RAHMAN, ASHIQUR; BELAS, JAROSLAV] TOMAS BATA UNIV ZLIN, DEPT ENTERPRISE ECON, MOSTNI 5139, ZLIN 76001, CZECH REPUBLIC.; [RAHMAN, M. TWYEAFUR] STRATHCLYDE BUSINESS SCH, DEPT ECON, 130 ROTTENROW, GLASGOW G4 0QU, LANARK, SCOTLAND.","RAHMAN, A (REPRINT AUTHOR), TOMAS BATA UNIV ZLIN, DEPT ENTERPRISE ECON, MOSTNI 5139, ZLIN 76001, CZECH REPUBLIC.","RAHMAN@FAME.UTB.CZ","INTERNAL GRANT AGENCY OF FAME TBU [IGA/FAME/2017/010]","THE AUTHORS ARE THANKFUL TO THE INTERNAL GRANT AGENCY OF FAME TBU NO. IGA/FAME/2017/010: FINANCIAL CONSTRAINTS ON ECONOMIC ACTIVITIES, FOR FINANCIAL SUPPORT TO CARRY OUT THIS RESEARCH.","ALESINA AF, 2013, J EUR ECON ASSOC, V11, P45, DOI 10.1111/J.1542-4774.2012.01100.X; AYYAGARI M, 2007, SMALL BUS ECON, V29, P415, DOI 10.1007/S11187-006-9002-5; BAREGHEH A, 2009, MANAGE DECIS, V47, P1323, DOI 10.1108/00251740910984578; BECK T, 2006, J BANK FINANC, V30, P2931, DOI 10.1016/J.JBANKFIN.2006.05.009; BECK T, 2011, J FINANC SERV RES, V39, P35, DOI 10.1007/S10693-010-0085-4; BELAS J., 2016, J INT STUDIES, V9, P139, DOI DOI 10.14254/2071-833330.2016/9-2/10; BELLUCCI A, 2010, J BANK FINANC, V34, P2968, DOI 10.1016/J.JBANKFIN.2010.07.008; BERGER AN, 2011, J FINANC INTERMED, V20, P55, DOI 10.1016/J.JFI.2010.01.001; BERGER AN, 2002, ECON J, V112, PF32, DOI 10.1111/1468-0297.00682; BESANKO D, 1987, INT ECON REV, V28, P671, DOI 10.2307/2526573; BESTER H, 1987, EUR ECON REV, V31, P887, DOI 10.1016/0014-2921(87)90005-5; BLAZY R, 2013, [NO TITLE CAPTURED], V23, P1109, DOI DOI 10.1080/09603107.2013.795272; BOLTON P., 2013, RELATIONSHIP T LEAND; BONINI S, 2016, INT REV FINANC ANAL, V45, P172, DOI 10.1016/J.IRFA.2016.03.013; BRANCATI E, 2015, SMALL BUS ECON, V44, P449, DOI 10.1007/S11187-014-9603-3; BRICK IE, 2007, J FINANC INTERMED, V16, P452, DOI 10.1016/J.JFI.2007.01.001; CARTER DA, 2004, J FINANCIAL SERVICES, V25, P233, DOI DOI 10.1023/B:FINA.0000020663.21079.D2; CARTER S., 1998, ENTREP REGION DEV, V10, P225, DOI DOI 10.1080/08985629800000013; CENNI S, 2015, J BANK FINANC, V53, P249, DOI 10.1016/J.JBANKFIN.2014.12.010; CHAIBI H, 2015, RES INT BUS FINANC, V33, P1, DOI 10.1016/J.RIBAF.2014.06.001; CHAKRABORTY A, 2006, J FINANC INTERMED, V15, P86, DOI 10.1016/J.JFI.2005.07.002; CHAN YS, 1985, J MONEY CREDIT BANK, V17, P84, DOI 10.2307/1992508; COLE RA, 1998, J BANK FINANC, V22, P959, DOI 10.1016/S0378-4266(98)00007-7; COMEIG I, 2015, J BUS RES, V68, P1650, DOI 10.1016/J.JBUSRES.2015.02.012; DIERKES M, 2013, J BANK FINANC, V37, P2867, DOI 10.1016/J.JBANKFIN.2013.03.018; FARINHA L, 2015, FINANC RES LETT, V14, P167, DOI 10.1016/J.FRL.2015.05.001; FERRI G, 2015, J FINANC INTERMED, V24, P231, DOI 10.1016/J.JFI.2014.09.002; FREEL MS, 2007, SMALL BUS ECON, V28, P23, DOI 10.1007/S11187-005-6058-6; GARWE DK, 2012, DEV SO AFR, V29, P448, DOI 10.1080/0376835X.2012.706040; GODLEWSKI CJ, 2011, J FINANC SERV RES, V40, P49, DOI 10.1007/S10693-010-0099-Y; GOMPERS PA, 1995, J FINANC, V50, P1461, DOI 10.1111/J.1540-6261.1995.TB05185.X; HAINZ C, 2013, J FINANC SERV RES, V44, P131, DOI 10.1007/S10693-012-0141-3; HALL BH, 2002, OXFORD REV ECON POL, V18, P35, DOI 10.1093/OXREP/18.1.35; HANEDAR EY, 2014, J BANK FINANC, V38, P106, DOI 10.1016/J.JBANKFIN.2013.09.019; HERNANDEZ-CANOVAS G, 2010, SMALL BUS ECON, V34, P465, DOI 10.1007/S11187-008-9129-7; IRWIN D, 2010, INT J ENTREP BEHAV R, V16, P245, DOI 10.1108/13552551011042816; KIRSCHENMANN K, 2016, J FINANC INTERMED, V26, P68, DOI 10.1016/J.JFI.2015.11.001; KNYAZEVA A, 2012, J BANK FINANC, V36, P1194, DOI 10.1016/J.JBANKFIN.2011.11.011; LEE N, 2015, RES POLICY, V44, P370, DOI 10.1016/J.RESPOL.2014.09.008; LEON F, 2015, J BANK FINANC, V57, P130, DOI 10.1016/J.JBANKFIN.2015.04.005; MENKHOFF L, 2012, J BANK FINANC, V36, P817, DOI 10.1016/J.JBANKFIN.2011.09.010; MIAN A, 2003, FOREIGN PRIVATE DOME; MOHNEN P, 2005, EUR ECON REV, V49, P1431, DOI 10.1016/J.EUROECOREV.2003.12.003; MURAVYEV A, 2009, J COMP ECON, V37, P270, DOI 10.1016/J.JCE.2008.12.001; MYERS SC, 1984, J FINANC ECON, V13, P187, DOI 10.1016/0304-405X(84)90023-0; NEUBERGER D, 2015, SMALL BUS ECON, V44, P411, DOI 10.1007/S11187-014-9602-4; NEUBERGER D, 2006, ECON NOTES, V35, P319, DOI 10.1111/J.1468-0300.2006.00168.X; ORTIZ-MOLINA H, 2008, SMALL BUS ECON, V30, P361, DOI 10.1007/S11187-007-9053-2; PEDERZOLI C, 2013, J FINANC SERV RES, V44, P111, DOI 10.1007/S10693-012-0152-0; PETERSEN MA, 1995, Q J ECON, V110, P407, DOI 10.2307/2118445; PETERSEN MA, 2002, J FINANC, V57, P2533, DOI 10.1111/1540-6261.00505; RAHMAN A., 2016, J INT STUDIES, V9, P112; RAHMAN A., 2016, ACTUAL PROBL ECON, V9, P294; RAHMAN MT, 2013, LOCAL ECON, V28, P85, DOI 10.1177/0269094212466036; SHUMWAY T, 2001, J BUS, V74, P101, DOI 10.1086/209665; STEFANI ML, 2015, CESIFO ECON STUD, V61, P165, DOI 10.1093/CESIFO/IFU031; STEIJVERS T, 2010, SMALL BUS ECON, V34, P243, DOI 10.1007/S11187-008-9124-Z; STIGLITZ JE, 1981, AM ECON REV, V71, P393; UCHIDA H, 2012, J FINANC INTERMED, V21, P97, DOI 10.1016/J.JFI.2011.06.002; WATSON J, 2009, INT J GEND ENTREP, V1, P42, DOI 10.1108/17566260910942336","60",4,"4","1","18","DE GRUYTER OPEN LTD","WARSAW","BOGUMILA ZUGA 32A ST, 01-811 WARSAW, POLAND","1213-2446","1804-1663","REV ECON PERSPECT","REV. ECON. PERSPECT.","10.1515/REVECP-2017-0014",NA,"23","ECONOMICS","BUSINESS & ECONOMICS","FM0FV","ISI000414638600003","2020-02-17","","SEP",2017,"17","3","263","285","DOAJ GOLD, GREEN PUBLISHED",NA,"RAHMAN, ASHIQUR/0000-0003-1286-0940",NA,NA,NA,NA,NA,NA,NA,NA,NA,NA,NA,NA,NA,"ISI","TOMAS BATA UNIV ZLIN;STRATHCLYDE BUSINESS SCH","TOMAS BATA UNIV ZLIN",NA,"RAHMAN A, 2017, REV ECON PERSPECT"
"100","RUI L, 2010, APPL ECON","10.1080/00036840701721604",2010,1,13,"Econometric Analysis Of Credit Constraints Of Chinese Rural Households And Welfare Loss","Rui, Li; Xi, Zhu",NA,NA,"","APPLIED ECONOMICS","2010",2010,42,"13","",NA,"","1615","1625","PII 789118469","10.1080/00036840701721604","","",13,1.18,0,0,0,0,0,0,0,0,0,0,0,0,0,0,0,0,0,0,0,0,0,0,0,0,0,0,0,0,2,3,1,2,2,0,3,0,"J","RUI L;XI Z","RUI, LI; XI, ZHU","APPLIED ECONOMICS","ENGLISH","ARTICLE",NA,"IDENTIFICATION; MARKETS","USING RECENT SURVEY DATA OF CHINESE RURAL HOUSEHOLDS, WE ESTIMATE THE IMPACT OF CREDIT CONSTRAINTS ON CHINESE RURAL HOUSEHOLDS' INCOME AND CONSUMPTION. RESULTS REVEAL THAT 71% OF RURAL HOUSEHOLDS ARE RATIONED IN THE CREDIT MARKETS. THE CREDIT CONSTRAINTS HAVE SIGNIFICANT NEGATIVE EFFECTS ON THE INCOME AND CONSUMPTION OF RURAL HOUSEHOLDS. THE EXPENDITURES ON EDUCATION AND MEDICAL TREATMENTS, THE SIZE OF LAND HOLDINGS, HOUSEHOLD HEAD EDUCATION AND THE BALANCE OF FINANCIAL CAPITAL ALL AFFECT THE DEMAND OF CREDIT. PERSONAL CONNECTIONS (RELATIONSHIP) ARE THE MOST IMPORTANT DETERMINATE OF THE SUPPLY FOR CREDIT.","[RUI, LI] BEIJING UNIV AERONAUT & ASTRONAUT, SCH ECON & MANAGEMENT, BEIJING 100083, PEOPLES R CHINA.; [XI, ZHU] SHANGHAI JIAO TONG UNIV, ANTAI COLL ECON & MANAGEMENT, SHANGHAI 200052, PEOPLES R CHINA.","RUI, L (REPRINT AUTHOR), BEIJING UNIV AERONAUT & ASTRONAUT, SCH ECON & MANAGEMENT, XUEYUAN RD 37, BEIJING 100083, PEOPLES R CHINA.","LIRUI@BUAA.EDU.CN",NA,NA,"ABADIE A, 2006, ECONOMETRICA, V74, P235, DOI 10.1111/J.1468-0262.2006.00655.X; ANGRIST JD, 1996, J AM STAT ASSOC, V91, P444, DOI 10.2307/2291629; CARTER MR, 1998, J DEV STUD, V28, P83; CRISTINA D, 1980, BORROWERS LENDERS RU; DUTTA D, 2006, APPL ECON, V38, P1627, DOI 10.1080/00036840500427148; FEDER G, 1990, AM J AGR ECON, V72, P1151, DOI 10.2307/1242524; FOLTZ JD, 2004, AGR ECON, V30, P229, DOI [10.1016/J.AGECON.2002.12.003, 10.1111/J.1574-0862.2004.TB00191.X]; HECKMAN JJ, 1998, REV ECON STUD, V65, P261, DOI 10.1111/1467-937X.00044; HECKMAN JJ, 1992, EVALUATING WELFARE AND TRAINING PROGRAMS, P201; IMBENS GW, 1994, ECONOMETRICA, V62, P467, DOI 10.2307/2951620; KOCHAR A, 1997, J DEV ECON, V53, P339, DOI 10.1016/S0304-3878(97)00020-5; KRANDKER SR, 2003, AGR EC, V28, P197; MANRIQUE J, 2004, APPL ECON, V36, P781, DOI 10.1080/0003684042000229514; MENG CL, 1985, INT ECON REV, V26, P71, DOI 10.2307/2526528; MILDE H, 1988, Q J ECON, V103, P101, DOI 10.2307/1882644; MYERS RH, 2000, RURAL FINANCIAL MARK, P5; POIRIER DJ, 1980, J ECONOMETRICS, V12, P209, DOI 10.1016/0304-4076(80)90007-X; ROSENBAUM PR, 1983, BIOMETRIKA, V70, P41, DOI 10.1093/BIOMET/70.1.41; RUBIN DB, 1974, J EDUC PSYCHOL, V66, P688, DOI 10.1037/H0037350; STIGLITZ JE, 1981, AM ECON REV, V71, P393; WOOLDRIDGE J. M., 2003, ECONOMETRIC ANAL CRO","21",13,"13","1","13","ROUTLEDGE JOURNALS, TAYLOR & FRANCIS LTD","ABINGDON","2-4 PARK SQUARE, MILTON PARK, ABINGDON OX14 4RN, OXON, ENGLAND","0003-6846","1466-4283","APPL ECON","APPL. ECON.","10.1080/00036840701721604",NA,"11","ECONOMICS","BUSINESS & ECONOMICS","602LB","ISI000278139600002","2020-02-17","",NA,2010,"42","13","1615","1625",NA,"PII 789118469",NA,NA,NA,NA,NA,NA,NA,NA,NA,NA,NA,NA,NA,NA,"ISI","BEIJING UNIV AERONAUT AND ASTRONAUT;SHANGHAI JIAO TONG UNIV","BEIJING UNIV AERONAUT AND ASTRONAUT",NA,"RUI L, 2010, APPL ECON"
"101","RUZIEV K, 2015, J DEV STUD","10.1080/00220388.2014.989991",2015,2,6,"Connectedness And Sme Financing In Post-Communist Economies: Evidence From Uzbekistan","Ruziev, Kobil; Midmore, Peter",NA,NA,"","JOURNAL OF DEVELOPMENT STUDIES","MAY 4 2015",2015,51,"5","",NA,"","586","602","","10.1080/00220388.2014.989991","","",6,1,0,0,0,0,0,0,0,0,0,0,0,0,0,0,0,0,0,0,0,0,0,0,0,0,0,0,0,0,0,0,0,1,0,2,3,0,"J","RUZIEV K;MIDMORE P","RUZIEV, KOBIL; MIDMORE, PETER","JOURNAL OF DEVELOPMENT STUDIES","ENGLISH","ARTICLE",NA,"POLITICAL CONNECTIONS; FIRM PERFORMANCE; DISCRIMINATION; CONSTRAINTS; GROWTH; ACCESS; ENTREPRENEURS; COUNTRIES; SERVICES; BRIBERY","THIS PAPER INVESTIGATES EFFECTS OF INTERPERSONAL LINKS WITH BUREAUCRATS ON SME ACCESS TO FORMAL FINANCE. A SURVEY OF 502 SMES IN POST-COMMUNIST UZBEKISTAN SHOWS FEWER SMES WITH GOVERNMENT CONNECTIONS EXPRESS A NEED FOR EXTERNAL FINANCE, BUT SUCCESS RATES OF APPLICATIONS ARE HIGHER THAN FOR SMES WITHOUT CONNECTIONS. ECONOMETRIC MODELS SHOW GOVERNMENT-CONNECTED SMES RECEIVE MORE FORMAL CREDIT THAN THEIR COUNTERPARTS. THE SMALL SHARE OF SME CREDIT AVAILABLE IS THUS DISTRIBUTED IN FAVOUR OF THOSE CAPITALISING ON BUREAUCRATIC LINKS, WITH CONSEQUENT RESOURCE MISALLOCATION. FINDINGS IMPLY THAT GREATER SME CREDIT FLOWS NEED SUPPLEMENTING WITH CAPACITY BUILDING THAT IMPROVES BANK TRANSPARENCY AND EFFICIENCY.","[RUZIEV, KOBIL] UNIV W ENGLAND, BRISTOL BUSINESS SCH, CTR GLOBAL FINANCE, BRISTOL BS16 1QY, AVON, ENGLAND.; [MIDMORE, PETER] ABERYSTWYTH UNIV, SCH BUSINESS & MANAGEMENT, CTR LOCAL & REG ENTERPRISE, ABERYSTWYTH SY23 3FG, DYFED, WALES.","RUZIEV, K (REPRINT AUTHOR), UNIV W ENGLAND, BRISTOL BUSINESS SCH, CTR GLOBAL FINANCE, FRENCHAY CAMPUS,COLDHARBOUR LANE, BRISTOL BS16 1QY, AVON, ENGLAND.","KOBIL.RUZIEV@UWE.AC.UK","BRITISH ACADEMY FOR THE HUMANITIES AND SOCIAL SCIENCES [SG 51904]","THIS WORK WAS SUPPORTED BY THE BRITISH ACADEMY FOR THE HUMANITIES AND SOCIAL SCIENCES [GRANT NUMBER SG 51904].","ACEMOGLU DARON, 2005, HDB EC GROWTH A, V1A, P386, DOI DOI 10.1016/S1574-0684(05)01006-3; AKIMOV A, 2009, ECON CHANG RESTRUCT, V42, P293, DOI 10.1007/S10644-009-9073-9; ASIAN DEVELOPMENT BANK - ADB, 2011, KEY IND AS PAC 2011; AYYAGARI M, 2008, WORLD BANK ECON REV, V22, P483, DOI 10.1093/WBER/LHN018; BECK T, 2008, WORLD BANK ECON REV, V22, P383, DOI 10.1093/WBER/LHN021; BECK T, 2008, WORLD BANK ECON REV, V22, P397, DOI 10.1093/WBER/LHN020; BERGER AN, 1998, J BANK FINANC, V22, P613, DOI 10.1016/S0378-4266(98)00038-7; BLANCHARD L, 2008, J URBAN ECON, V63, P467, DOI 10.1016/J.JUE.2007.03.001; BLANCHFLOWER DG, 2003, REV ECON STAT, V85, P930, DOI 10.1162/003465303772815835; CAVALLUZZO KS, 2002, J BUS, V75, P641, DOI 10.1086/341638; CAVALLUZZO KS, 1998, J MONEY CREDIT BANK, V30, P771, DOI 10.2307/2601128; CBU, 2012, MON CRED POL ANN REP; CBU, 2011, MON CRED POL ANN REP; CHANDAVARKAR A, 1992, WORLD DEV, V20, P133, DOI 10.1016/0305-750X(92)90142-I; CLAESSENS S, 2007, J COMP ECON, V35, P748, DOI 10.1016/J.JCE.2007.07.002; CLAESSENS S, 2006, WORLD BANK RES OBSER, V21, P207, DOI 10.1093/WBRO/LKL004; DASGUPTA P, 2005, ECON REC, V81, PS2, DOI 10.1111/J.1475-4932.2005.00245.X; DEMIRGUC-KUNT A, 1998, J FINANC, V53, P2107, DOI 10.1111/0022-1082.00084; *EBRD, 2000, TRANS REP; FACCIO M, 2006, AM ECON REV, V96, P369, DOI 10.1257/000282806776157704; FACCIO M, 2006, J FINANC, V61, P2597, DOI 10.1111/J.1540-6261.2006.01000.X; FEDDERKE J, 1999, THEOR SOC, V28, P709, DOI 10.1023/A:1007021914850; FRYE T, 1997, AM ECON REV, V87, P354; HALL RE, 1999, Q J ECON, V114, P83, DOI 10.1162/003355399555954; HELLIWELL J., 2001, SOCIAL CAPITAL MULTI, P253; HONOHAN P., 2006, 200691 UNUWIDER; HUNT J, 2012, WORLD DEV, V40, P355, DOI 10.1016/J.WORLDDEV.2011.06.001; KORNAI J, 2000, J ECON PERSPECT, V14, P27, DOI 10.1257/JEP.14.1.27; LA PORTA R, 2002, J FINANC, V57, P265, DOI 10.1111/1540-6261.00422; LA PORTA R, 1998, J POLIT ECON, V106, P1113, DOI 10.1086/250042; LEVINE R, 2005, HDB EC GROWTH 1, V1, P866, DOI DOI 10.1016/S1574-0684(05)01012-9; LI D. D., 1998, AM ECON REV, V88, P323; LI DD, 1996, J COMP ECON, V23, P1, DOI 10.1006/JCEC.1996.0040; LI HB, 2008, J DEV ECON, V87, P283, DOI 10.1016/J.JDEVECO.2007.03.001; LOVE I, 2003, REV FINANC STUD, V16, P765, DOI 10.1093/RFS/HHG013; MCKEAN MA, 1992, J THEORETICAL POLITI, V4, P247, DOI DOI 10.1177/0951692892004003002; MORDUCH J, 1999, J ECON LIT, V37, P1569, DOI 10.1257/JEL.37.4.1569; MURAVYEV A, 2009, J COMP ECON, V37, P270, DOI 10.1016/J.JCE.2008.12.001; NORTH D. C., 1990, I I CHANGES EC PROSP; POMFRET R., 2010, 201053 UNUWIDER; ROSE R., 2001, SOCIAL CAPITAL MULTI, P147; RUZIEV K, 2014, POST-COMMUNIST ECON, V26, P415, DOI 10.1080/14631377.2014.937107; SEKER M, 2014, J COMP ECON, V42, P246, DOI 10.1016/J.JCE.2013.05.004; SERAGELDIN I., 2001, SOCIAL CAPITAL MULTI, P40; STIGLITZ J., 2001, SOCIAL CAPITAL MULTI, P59; WEBER MAX, 1968, EC AND SOC; WOOLDRIDGE J., 2006, INTRPDICTORY EC MODE; WOOLDRIDGE J, 2002, EC ANAL CROSS SECTIO; WORLD BANK, 2003, UZB EN SECT ISS AN A","49",6,"6","0","16","ROUTLEDGE JOURNALS, TAYLOR & FRANCIS LTD","ABINGDON","4 PARK SQUARE, MILTON PARK, ABINGDON OX14 4RN, OXFORDSHIRE, ENGLAND","0022-0388","1743-9140","J DEV STUD","J. DEV. STUD.","10.1080/00220388.2014.989991",NA,"17","DEVELOPMENT STUDIES; ECONOMICS","DEVELOPMENT STUDIES; BUSINESS & ECONOMICS","CL9VQ","ISI000357326600007","2020-02-17","","MAY 4",2015,"51","5","586","602",NA,NA,NA,NA,NA,NA,NA,NA,NA,NA,NA,NA,NA,NA,NA,NA,"ISI","UNIV W ENGLAND;ABERYSTWYTH UNIV","UNIV W ENGLAND",NA,"RUZIEV K, 2015, J DEV STUD"
"102","SACKEY FG, 2018, AGRIC FINANCE REV","10.1108/AFR-08-2017-0077",2018,0,2,"Is There Discrimination Against The Agricultural Sector In The Credit Rationing Behavior Of Commercial Banks In Ghana?","Sackey, Frank Gyimah",NA,NA,"","AGRICULTURAL FINANCE REVIEW","2018",2018,78,"3","",NA,"","348","363","","10.1108/AFR-08-2017-0077","","",2,0.67,0,0,0,0,0,0,0,0,0,0,0,0,0,0,0,0,0,0,0,0,0,0,0,0,0,0,0,0,0,0,0,0,0,0,2,0,"J","SACKEY FG","SACKEY, FRANK GYIMAH","AGRICULTURAL FINANCE REVIEW","ENGLISH","ARTICLE","DISCRIMINATION; CREDIT RATIONING; FINANCIAL LIBERALIZATION; BLINDER-OAXACA DECOMPOSITION; PROBIT ESTIMATION","IMPERFECT INFORMATION; MARKETS; GENDER; WOMEN","PURPOSE - THE PURPOSE OF THIS PAPER IS TO EXAMINE IF CREDIT RATIONING PERSISTS EVEN IN THE ERA OF FINANCIAL LIBERALIZATION, THE EXTENT TO WHICH INDIVIDUAL, FIRM AND LOAN CHARACTERISTICS INFLUENCE THE RATIONING BEHAVIOR OF COMMERCIAL BANKS AND WHETHER THE AGRICULTURAL SECTOR IS DISCRIMINATED AGAINST IN THE COMMERCIAL BANK CREDIT MARKET. DESIGN/METHODOLOGY/APPROACH - THE STUDY EMPLOYED A PROBIT MODEL WITH MARGINAL EFFECTS AND A GENERALIZED BLINDER-OAXACA DECOMPOSITION ESTIMATION ON A RANDOMLY SELECTED DATA OF 1,239 ENTREPRENEURS FROM EIGHT COMMERCIAL BANKS' CREDIT RECORDS ABOUT THEIR INDIVIDUAL, FIRM AND LOAN CHARACTERISTICS. FINDINGS - THE STUDY REVEALED THAT CREDIT RATIONING PERSISTS AND THAT APPLYING FOR A RELATIVELY LONGER PAYMENT PERIOD, PROVIDING COLLATERAL AND GUARANTOR, BEING ILLITERATE, BEING RELATIVELY OLDER AND BEING IN THE AGRICULTURAL SECTOR INCREASES THE LIKELIHOOD OF BEING CREDIT RATIONED, WHILE HAVING SOME RELATIONSHIP WITH THE BANK, HAVING NON-MANDATORY SAVINGS AND APPLYING FROM A BANK WITH RELATIVELY HIGH INTEREST RATES REDUCE THE LIKELIHOOD OF BEING CREDIT RATIONED. THE STUDY ALSO REVEALED A CREDIT GAP OF 17.77 PERCENT AND A POSITIVE DISCRIMINATION AGAINST BORROWERS IN THE AGRICULTURAL SECTOR AS THE GAP WAS LARGELY BEING INFLUENCED BY UNEXPLAINED FACTORS. RESEARCH LIMITATIONS/IMPLICATIONS - THE RESEARCH WAS INTENDED TO COVER A LARGE NUMBER OF COMMERCIAL BANKS IN GHANA. HOWEVER, MOST OF THE BANKS WERE UNWILLING TO PROVIDE SUCH INFORMATION ABOUT THEIR BORROWERS; HENCE, THE RESEARCH WAS LIMITED TO ONLY EIGHT COMMERCIAL BANKS WHO PROVIDED THE AUTHOR WITH THE INFORMATION NEEDED FOR THE STUDY. PRACTICAL IMPLICATIONS - THE STUDY CONCLUDES THAT POLICIES THAT ENHANCE HUMAN CAPITAL, WOMEN, AND OLDER ACCESS TO CREDIT AND AGRICULTURAL-ORIENTED FINANCIAL SERVICES AND OTHERS, WILL GO A LONG WAY TO REDUCE RATIONING AND INCREASE ACCESS TO CREDIT, ESPECIALLY TO THE AGRICULTURAL SECTOR. SOCIAL IMPLICATIONS - THE RESEARCH PROPOSES THE USE OF GROUP LENDING AS A FORM OF COLLATERAL AND MONITORING TO EASE RISKS AND DEFAULT, AND HENCE SUPPORTS SUSTAINABLE FUNDING TO INCREASE ACCESS AND OUTREACH. ORIGINALITY/VALUE - THE PAPER LOOKS AT THE COMPREHENSIVE WAY ABOUT THE VARIOUS FACTORS DETERMINING CREDIT RATIONING IN THAT IT CONSIDERS NOT ONLY THE INDIVIDUAL, ECONOMIC/FIRM AND LOAN CHARACTERISTICS BUT ALSO THE EXTENT TO WHICH DISCRIMINATION TOWARD THE AGRICULTURAL SECTOR EXISTS IN THE COMMERCIAL BANKS CREDIT MARKET.","[SACKEY, FRANK GYIMAH] CATHOLIC UNIV COLL GHANA, DEPT ECON, SUNYANI, GHANA.","SACKEY, FG (REPRINT AUTHOR), CATHOLIC UNIV COLL GHANA, DEPT ECON, SUNYANI, GHANA.","FRANKSACKEY@YAHOO.COM",NA,NA,"ABARU BM, 2006, AGRIC FINANCE REV, V66, P215, DOI 10.1108/00214660680001188; ACQUAH P. K., 2003, WOMEN ENTREPRENEURS; AFFUSO A., 2007, CREDIT RATIONING REA; AKUDUGU MA, 2009, AGRIC FINANCE REV, V69, P284, DOI 10.1108/00021460911002671; ARROW K., 1973, DISCRIMINATION LABOR, P3; ARYEETEY E., 2001, STRENGTHENING GHANAS; ARYEETEY E, 2000, EC REFORMS GHANA MIR; AWUNYO-VITOR D, 2014, AGRIC FINANCE REV, V74, P364, DOI 10.1108/AFR-01-2013-0004; BAYDAS M. M., 1993, SMALL ENTERPRISE DEV, V4, P195; BAYDAS MM, 1994, WORLD DEV, V22, P1073, DOI 10.1016/0305-750X(94)90149-X; BECKER G., 1957, EC DISCRIMINATION; BIKBAEVA G, 2009, PROBL EC TRANSIT, V52, P67; BLINDER AS, 1973, J HUM RESOUR, V8, P436, DOI 10.2307/144855; BREWER BE, 2014, AGRIC FINANCE REV, V74, P55, DOI 10.1108/AFR-04-2013-0014; CANTON E., 2010, ERIM REPORT SERIES R; CHAKRAVARTY S, 2010, RELATIONSHIP BANKING; DIAZ-SERRANO L, 2018, J SUSTAIN FINANC INV, V8, P114, DOI 10.1080/20430795.2017.1403181; DUGGLEBY T. J., 1995, FINANCE I IND ENERGY, V62; EKUMAH E. K., 2001, 014 IFLIP; FAFCHAMPS M, 1997, J BUS ECON STAT, V15, P180, DOI 10.2307/1392304; FLETSCHNER D, 2009, WORLD DEV, V37, P618, DOI 10.1016/J.WORLDDEV.2008.08.005; GHANA STATISTICAL SERVICE, 2014, GHAN LIV STAND SERV; GHANA STATISTICAL SERVICE, 2016, GHAN STAT DEV PROJ G; GODQUIN M., 2005, IFPRI UNPUB; ILO, 2007, ASS ENV DEV WOM ENTR; JAFFEE DM, 1976, Q J ECON, V90, P651, DOI 10.2307/1885327; LAWAL J.O., 2009, PAK J BIOSOCIAL SCI, V6, P159; LENSINK R., 2005, 9 NPT; LEONARDO G., 2009, RECENT TRENDS INCOME; MAYADA M., 1994, J DEV STUD, V31, P279; MCKINNON R. I., 1973, MONEY CAPITAL EC DEV; MIJID N, 2013, SOC SCI J, V50, P55, DOI 10.1016/J.SOSCIJ.2012.09.002; MORRIS G. A., 1993, WOMEN FINANCIAL SERV, P2056; MUHONGAYIRE W., 2013, J AGR SCI, V4, P87; NARAYAN T. A., 2001, DOES CREDIT CONSTRAI; NGUYEN C. H., 2007, INT C RUR FIN RES RO; NORMITO R., 2006, PHILIPINES MANAGEMEN, V13, P117; NURYARTONO N., 2005, DTSCH TROP U HOH STU; OAXACA R., 1973, INT ECON REV, V61, P693, DOI [DOI 10.2307/2525981, 10.2307/2525981.]; OKERENTA S. I., 2005, JOURNAL OF AGRICULTURE AND SOCIAL RESEARCH (JASR), V5, P67; PARIENTE W., 2005, PESQUISA DEBATE, V16, P150; PHELPS ES, 1972, AM ECON REV, V62, P659; RUDRIGUEZ C. A., 2001, CREDIT CONSTANTS FAC; RWEGASIRA K., 1992, PROBLEMS FINANCIAL A; SHAW E., 1973, FINANCIAL DEEPENING; SIMTOWE F, 2008, AGRIC FINANCE REV, V68, P255, DOI 10.1108/00214660880001229; STIGLITZ JE, 1981, AM ECON REV, V71, P393; SUBBOTIN A., 2005, 9 C COP COP; TINH D., 2010, WHAT DETERMINES CRED; UDRY C, 1996, J POLIT ECON, V104, P1010, DOI 10.1086/262050; UNIDO, 1983, 5 UNIDO; VASTHOFF J., 1968, SMALL FARM CREDIT DE; VILLANUEVA D, 1990, INT MONET FUND S PAP, V37, P509; VOORDECKERS W., 2011, J EC SURVEYS, V23; WORLD BANK, 2013, WOR DEV REP, P1, DOI 10.1596/978-0-8213-9575-2; WORLD BANK, 1990, WORLD DEV REP 1990 P; ZELLER M., 1994, WORLD DEV REPORT, V22, P47","57",2,"2","0","3","EMERALD GROUP PUBLISHING LTD","BINGLEY","HOWARD HOUSE, WAGON LANE, BINGLEY BD16 1WA, W YORKSHIRE, ENGLAND","0002-1466","2041-6326","AGRIC FINANCE REV","AGRIC. FINANCE REV.","10.1108/AFR-08-2017-0077",NA,"16","AGRICULTURAL ECONOMICS & POLICY","AGRICULTURE","GR2CT","ISI000442368600004","2020-02-17","",NA,2018,"78","3","348","363",NA,NA,NA,NA,NA,NA,NA,NA,NA,NA,NA,NA,NA,NA,NA,NA,"ISI","CATHOLIC UNIV COLL GHANA","CATHOLIC UNIV COLL GHANA",NA,"SACKEY FG, 2018, AGRIC FINANCE REV"
