"","Paper","DOI.x","Year","LCS","GCS","Title","Authors","Corporate.Authors","Editors","Book.Editors","Source.Title","Publication.Date","Publication.Year","Volume","Issue","Part.Number","Supplement","Special.Issue","Beginning.Page","Ending.Page","Article.Number","DOI.y","Conference.Title","Conference.Date","Total.Citations","Average.per.Year","X1985","X1986","X1987","X1988","X1989","X1990","X1991","X1992","X1993","X1994","X1995","X1996","X1997","X1998","X1999","X2000","X2001","X2002","X2003","X2004","X2005","X2006","X2007","X2008","X2009","X2010","X2011","X2012","X2013","X2014","X2015","X2016","X2017","X2018","X2019","X2020","PT","AU","AF","SO","LA","DT","DE","ID","AB","C1","RP","EM","FU","FX","CR","NR","TC","Z9","U1","U2","PU","PI","PA","SN","EI","J9","JI","DI","EA","PG","WC","SC","GA","UT","DA","ER","PD","PY","VL","IS","BP","EP","OA","AR","OI","RI","SI","CT","CY","CL","SP","SU","BE","SE","BN","PN","GP","HO","DB","AU_UN","AU1_UN","AU_UN_NR","SR_FULL"
"1","ABDALLAH AH, 2019, AGRIC FINANCE REV","10.1108/AFR-02-2018-0009",2019,0,4,"Impact Of Agricultural Credit On Farm Income Under The Savanna And Transitional Zones Of Ghana","Abdallah, Abdul-Hanan; Ayamga, Micheal; Awuni, Joseph A.",NA,NA,"","AGRICULTURAL FINANCE REVIEW","FEB 4 2019",2019,79,"1","",NA,"","60","84","","10.1108/AFR-02-2018-0009","","",4,2,0,0,0,0,0,0,0,0,0,0,0,0,0,0,0,0,0,0,0,0,0,0,0,0,0,0,0,0,0,0,0,0,0,0,3,1,"J","ABDALLAH AH;AYAMGA M;AWUNI JA","ABDALLAH, ABDUL-HANAN; AYAMGA, MICHEAL; AWUNI, JOSEPH A.","AGRICULTURAL FINANCE REVIEW","ENGLISH","ARTICLE","GHANA; AGRICULTURAL CREDIT; RURAL HOUSEHOLDS; FARM INCOME; SAVANNA; TRANSITIONAL","EMPIRICAL-EVIDENCE; ADOPTION; TECHNOLOGY; ACCESS; PRODUCTIVITY; OUTPUT","PURPOSE THE PURPOSE OF THIS PAPER IS TWOFOLD: TO DETERMINE THE FACTORS CONTRIBUTING TO FARM INCOME IN THE TRANSITIONAL AND SAVANNA ZONES OF GHANA AND TO ASCERTAIN VARIATIONS BETWEEN IN THE SAME AND ACROSS THE TWO LOCATIONS; AND TO DETERMINE THE IMPACT OF CREDIT ON FARM INCOME IN EACH OF THE TWO ZONES AND TO ASCERTAIN THE VARIATION IN IMPACT OF CREDIT ACROSS THE TWO LOCATIONS. DESIGN/METHODOLOGY/APPROACH IN ORDER TO ADDRESS ENDOGENEITY AND SAMPLE SELECTION BIAS, THE AUTHORS DRAW FROM THE THEORY OF IMPACT EVALUATION IN NONRANDOM EXPERIMENT, EMPLOYING THE ENDOGENOUS SWITCHING REGRESSION (ESR) WHILE USING THE PROPENSITY SCORE MATCHING (PSM) TO CHECK FOR ROBUSTNESS OF THE RESULTS. FINDINGS THE RESULTS SHOW SIGNIFICANT MEAN DIFFERENCES BETWEEN SOME CHARACTERISTICS OF HOUSEHOLDS THAT HAVE ACCESS TO CREDIT AND THOSE THAT DID NOT HAVE ACCESS. FURTHER, THE RESULTS REVEALED FARM SIZE, LABOR; GENDER, AGE, LITERACY, WEALTH AND GROUP MEMBERSHIP AS THE SIGNIFICANT DETERMINANTS OF BOTH CREDIT ACCESS AND INCOME IN THE TWO ZONES. WITH THE ESR, CREDIT ACCESS INCREASES HOUSEHOLDS FARM INCOME BY GH & 206.56/HA AND GH & 39.74/HA IN THE TRANSITIONAL AND SAVANNA ZONES, RESPECTIVELY, BUT WITH THE PSM, CREDIT INCREASES FARM INCOME BY GH & 201.50 AND GH & 45.69 AND IN THE TRANSITIONAL AND SAVANNA, RESPECTIVELY. RESEARCH LIMITATIONS/IMPLICATIONS THE MEAN DIFFERENCES IN CHARACTERISTICS OF THE HOUSEHOLDS REVEALED THE PRESENCE OF SELECTION BIAS IN THE DISTRIBUTION OF HOUSEHOLD'S COVARIATES IN THE TWO ZONES. THE RESULTS FURTHER INDICATE THE IMPORTANCE OF PRODUCTIVE RESOURCES, INFORMATION AND HOUSEHOLD CHARACTERISTICS IN IMPROVED ACCESS TO CREDIT AND FARM INCOME. ALSO, THE RESULTS FROM BOTH METHODS INDICATE THAT CREDIT ACCESS LEADS TO SIGNIFICANT GAINS IN FARM INCOME FOR HOUSEHOLDS IN BOTH ZONES. HOWEVER, DIFFERENCES EXIST IN THE RESULTS OF PSM AND THAT OF THE ESR RESULTS. PRACTICAL IMPLICATIONS THE PRESENCE OF SELECTION BIAS IN THE SAMPLES SUGGESTS THAT THE USE OF ESR AND PSM TECHNIQUES IS APPROPRIATE. FURTHER, THE RESULTS SUGGESTING THAT ENHANCED CREDIT ACCESS AND FARM INCOME COULD BE ATTAINED THROUGH IMPROVED ACCESS TO HOUSEHOLD RESOURCES AND INFORMATION. THE RESULTS ALSO SUGGEST THE NEED FOR ESTABLISHING AND EXPANDING CREDIT PROGRAMS TO COVER MORE HOUSEHOLDS IN BOTH ZONES. THE DIFFERENTIAL IMPACT OF CREDIT BETWEEN THE TWO METHODS EMPLOYED IN EACH ZONE REVEALED THE WEAKNESS OF EACH MODEL. THE LOW VALUES FROM PSM COULD INDICATE THE PRESENCE OF SELECTION BIAS RESULTING FROM UNOBSERVABLE FACTORS WHILES THE HIGH VALUES FROM THE ESR COULD STEM FROM THE RESTRICTIVE ASSUMPTION OF THE MODEL. THIS REINFORCES THE IMPORTANCE OF COMBINING MIXED METHODS TO CHECK ROBUSTNESS OF RESULTS AND TO EXPLORE THE WEAKNESS OF EACH METHOD EMPLOYED. ORIGINALITY/VALUE THE NOVELTY OF THIS STUDY LIES IN THE USE OF A VERY EXTENSIVE AND UNIQUE DATA SET TO DECOMPOSE THE DETERMINANTS OF CREDIT ACCESS AND FARM INCOME AND AS WELL AS THE IMPACTS OF CREDIT INTO ZONES.","[ABDALLAH, ABDUL-HANAN] UNIV DEV STUDIES, DEPT AGRIBUSINESS MANAGEMENT & FINANCE, TAMALE, GHANA.; [AYAMGA, MICHEAL; AWUNI, JOSEPH A.] UNIV DEV STUDIES, DEPT AGR & RESOURCE ECON, TAMALE, GHANA.","ABDALLAH, AH (REPRINT AUTHOR), UNIV DEV STUDIES, DEPT AGRIBUSINESS MANAGEMENT & FINANCE, TAMALE, GHANA.","ABDALLAHABDULHANAN@GMAIL.COM; MAYAMGA@UDS.EDU.GH; JOSEPHAWUNIGH@YAHOO.CO.UK",NA,NA,"ABDALLAH AH, 2016, AGRIC FINANCE REV, V76, P494, DOI 10.1108/AFR-05-2016-0052; ABDALLAH AH, 2016, AGRIC FINANCE REV, V76, P309, DOI 10.1108/AFR-01-2016-0002; ABDULAI A, 2006, ENVIRON DEV ECON, V11, P201, DOI 10.1017/S1355770X05002779; ABDULAI A., 2008, PROPERTY RIGHTS INVE; ABEBAW D, 2013, FOOD POLICY, V38, P82, DOI 10.1016/J.FOODPOL.2012.10.003; ABU BM, 2017, AGRIC FINANCE REV, V77, P524, DOI [10.1108/AFR-02-2017-0007, 10.1108/AFR-02-2017-0007]; ADAM I., 2015, THESIS; AFARI E, 2001, THESIS; AKRAM W., 2008, EUROPEAN J SCI RES, V23, P294; AKUDUGU M. A., 2014, JOURNAL OF DEVELOPMENT AND AGRICULTURAL ECONOMICS, V6, P412; AKUDUGU MA, 2016, AGRIC FINANCE REV, V76, P288, DOI 10.1108/AFR-12-2015-0058; AL K., 2013, BRIT J EC MANAGEMENT, V2, P353; ANANG B. T., 2016, JOURNAL OF AGRICULTURE AND RURAL DEVELOPMENT IN THE TROPICS AND SUBTROPICS, V117, P189; AWOTIDE B.A., 2015, INT C AGR EC ICAE IN, P1; AYAMGA M., 2013, INT C AFR ASS AGR EC, V4, P1; BARRETT CB, 2001, ECON DEV CULT CHANGE, V49, P335, DOI 10.1086/452505; BINSWANGER HP, 1995, J DEV STUD, V32, P234, DOI 10.1080/00220389508422413; BLUNDELL RW, 1989, REV ECON STUD, V56, P37, DOI 10.2307/2297748; DEHEJIA RH, 2002, REV ECON STAT, V84, P151, DOI 10.1162/003465302317331982; DI FALCO S., 2010, CTR CLIMATE CHANGE E, V22, P1; DI FALCO S, 2011, J DEV STUD, V47, P1128, DOI 10.1080/00220388.2010.514328; DOSS CR, 2001, AGR ECON-BLACKWELL, V25, P27, DOI 10.1016/S0169-5150(00)00096-7; EL-SHATER T, 2016, J AGR ECON, V67, P154, DOI 10.1111/1477-9552.12133; FAFCHAMPS M, 2002, OXFORD ECON PAP, V54, P173, DOI 10.1093/OEP/54.2.173; FAPDA, 2015, FOOD AGR ORG UN, V717, P1; FOLTZ JD, 2004, AGR ECON, V30, P229, DOI [10.1016/J.AGECON.2002.12.003, 10.1111/J.1574-0862.2004.TB00191.X]; FUGLIE KO, 1995, AM J AGR ECON, V77, P891, DOI 10.2307/1243812; GIANG T.T., 2015, J FINANCE EC, V3, P29, DOI [10.12691/JFE-3-2-1, DOI 10.12691/JFE-3-2-1]; GOLDSTEIN M, 2008, J POLIT ECON, V116, P981; HANANU B., 2015, AFRICAN JOURNAL OF AGRICULTURAL RESEARCH, V10, P645; IDDRISU A, 2018, AGRIC FINANCE REV, V78, P98, DOI 10.1108/AFR-05-2017-0032; IMBENS GW, 2009, J ECON LIT, V47, P5, DOI 10.1257/JEL.47.1.5; JOHNSON M., 2011, EVALUATION 4 SPECIAL; KASSIE M., 2008, WORKING PAPERS EC, P27; KHANDKER S.R., 2010, HDB IMPACT EVALUATIO; KLEEMANN L, 2014, WORLD DEV, V64, P79, DOI 10.1016/J.WORLDDEV.2014.05.005; LOKSHIN M, 2004, STATA J, V4, P282, DOI 10.1177/1536867X0400400306; MA WL, 2016, CHINA AGR ECON REV, V8, P2, DOI 10.1108/CAER-04-2015-0035; MADDALA G. S., 1992, INTRO ECONOMETRICS; MARTINELLI E, 2015, SPRINGER THESES-RECO, P1, DOI 10.1007/978-3-319-26473-8_1; MOFA, 2013, AGR GHAN FACTS FIG 2; MUYANGA M, 2014, FOOD POLICY, V48, P98, DOI 10.1016/J.FOODPOL.2014.03.001; SAKPRACHAWUT S, 2016, AGRIC FINANCE REV, V76, P270, DOI 10.1108/AFR-12-2015-0055; SAMUEL B., 2011, EVALUATION 4 SPECIAL; SEKYI S, 2017, AGRIC FINANCE REV, V77, P446, DOI [10.1108/AFR-10-2016-0078, 10.1108/AFR-10-2016-0078]; SHIFERAW B, 1998, AGR ECON-BLACKWELL, V18, P233, DOI 10.1016/S0169-5150(98)00036-X; USAID FINGAP, 2013, USAID FIN GHAN AGR P; VERONESI M., 2012, WORKING PAPER SERIES, V14, P1; WORLD BANK, 2012, AGR IND GHAN; ZERO HUNGER CHALLENGE, 2016, ZERO HUNGER CHALLENG, V2, P1","50",4,"4","1","12","EMERALD GROUP PUBLISHING LTD","BINGLEY","HOWARD HOUSE, WAGON LANE, BINGLEY BD16 1WA, W YORKSHIRE, ENGLAND","0002-1466","2041-6326","AGRIC FINANCE REV","AGRIC. FINANCE REV.","10.1108/AFR-02-2018-0009",NA,"25","AGRICULTURAL ECONOMICS & POLICY","AGRICULTURE","HH6DK","ISI000455818900004","2020-02-17","","FEB 4",2019,"79","1","60","84",NA,NA,"AWUNI, JOSEPH AGEBASE/0000-0003-0940-9462",NA,NA,NA,NA,NA,NA,NA,NA,NA,NA,NA,NA,NA,"ISI","UNIV DEV STUDIES;UNIV DEV STUDIES","UNIV DEV STUDIES",NA,"ABDALLAH AH, 2019, AGRIC FINANCE REV"
"2","ADESUA-LINCOLN A, 2011, AFR J BUS MANAGE",NA,2011,1,5,"Assessing Nigerian Female Entrepreneur's Access To Finance For Business Start-Up And Growth","Adesua-Lincoln, Adebimpe",NA,NA,"","AFRICAN JOURNAL OF BUSINESS MANAGEMENT","JUL 4 2011",2011,5,"13","",NA,"","5348","5355","","","","",5,0.5,0,0,0,0,0,0,0,0,0,0,0,0,0,0,0,0,0,0,0,0,0,0,0,0,0,0,0,0,1,0,0,1,1,2,0,0,"J","ADESUA-LINCOLN A","ADESUA-LINCOLN, ADEBIMPE","AFRICAN JOURNAL OF BUSINESS MANAGEMENT","ENGLISH","ARTICLE","FEMALE ENTREPRENEURS; WOMEN; FINANCE; MOTIVATION; CHARACTERISTICS; NIGERIA; START-UP; GROWTH","MOTIVATIONS; CREDIT; TERMS","RESEARCH EMPHASIS IN MANY TRANSITION ECONOMIES HIGHLIGHTS THE IMPACT OF FINANCE FOR START-UP AND GROWTH AS THE PRINCIPAL FACTOR AFFECTING WOMEN'S ENTRY INTO BUSINESS AND THEIR SUBSEQUENT GROWTH. THE NEED TO CONDUCT STUDIES SPECIFICALLY ON NIGERIAN FEMALE ENTREPRENEURS IS BASED ON THE FACT THAT VERY LITTLE IS KNOWN ABOUT SUCH FIRMS, THUS A BETTER UNDERSTANDING IS NEEDED. THE STUDY EXPLORED NIGERIAN FEMALE ENTREPRENEURS BASED ON A SURVEY OF 132 FEMALE-OWNED FIRMS. THE STUDY SOUGHT TO CONSTRUCT A TYPOLOGY IN TERMS OF THEIR DEMOGRAPHIC CHARACTERISTICS AND MOTIVATION FOR GOING INTO BUSINESS, AS WELL AS ACCESS TO FINANCE WHEN STARTING OR EXPANDING THEIR BUSINESS VENTURE. THE FINDINGS REVEALED THAT NIGERIAN FEMALE ENTREPRENEURS ARE PARTICULARLY CONSTRAINED BY THEIR WEAK FINANCIAL BASE AND LACK OF COLLATERAL. MANY OF THE WOMEN IN THE STUDY WERE SEEN TO RESORT TO INTERNAL SOURCES OF FINANCE FOR THEIR START-UP AND WORKING CAPITALS. WHILE MANY OF THE CHALLENGES FACED BY FEMALE ENTREPRENEURS CAN ALSO BE LINKED TO THE INFERIOR STATUS OF WOMEN IN MANY AFRICAN SOCIETIES, THEIR UNDERESTIMATION AS ECONOMIC AGENTS, AS WELL AS GENDER BIAS EMBEDDED IN TRIBAL AND CULTURAL NORMS, THE FINDING SHOWED GENDER IS EXTRANEOUS TO THE PRACTICES OF FINANCIAL INSTITUTIONS WHEN DEALING WITH FEMALE ENTREPRENEURS.","UNIV WALES INST UWIC, CARDIFF, S GLAM, WALES.","ADESUA-LINCOLN, A (REPRINT AUTHOR), UNIV WALES INST UWIC, CARDIFF, S GLAM, WALES.","BLINCOLN@UWIC.AC.UK",NA,NA,"ADEREMI HO, 2008, AFR J BUS MANAGE, V2, P165; ALDRICH HE, 1996, ENTREPRENEURSHIP GLO; ANDERSON S., 2001, RR00201 SMALL BUS SE; ANNA AL, 2000, J BUS VENTURING, V15, P279, DOI 10.1016/S0883-9026(98)00012-3; BELL J, 1997, DOING YOUR RES PROJE; BIRLEY S, 1994, J BUS VENTURING, V9, P7, DOI 10.1016/0883-9026(94)90024-8; BIRLEY S., 1987, AM J SMALL BUSINESS, V12, P27; BROWN RC, 1997, INT C WOM SMES STELL; BROWN S.A., 1989, CANADIAN BANKER, P32; BRUSH C, 1990, LOCAL INITIATIVES JO; BRUSH C.G., 1992, ENTREP THEORY PRACT, V16, P5, DOI DOI 10.1177/104225879201600401; BRUSH C.G., 2004, CLEARING HURDLES WOM; BRUSH CG, 2001, [NO TITLE CAPTURED]; BUTTNER EH, 1989, J BUS VENTURING, V4, P249, DOI 10.1016/0883-9026(89)90015-3; BUTTNER EH, 1997, J SMALL BUS MANAGE, V35, P34; CARTER S., 1998, ENTREP REGION DEV, V10, P225, DOI DOI 10.1080/08985629800000013; CARTER S, 1992, WOMEN ENTREPRENEURS; CARTER S, 2009, ACCESS FINANCE NATL; CARTER S., 2000, ENTERPRISE SMALL BUS, P166; CARTER S, 2007, GENDER ENTREPRENEURS; CHEN MA, 2002, 20022 ILO EMPL SECT; CHURCHILL NC, 1983, HARVARD BUS REV, V61, P30; COLEMAN S, 2000, J SMALL BUS MANAGE, V38, P37; COLEMAN S., 2002, J DEV ENTREPRENEURSH, V7, P151; COLEMAN S, 2007, J SMALL BUS MANAGE, V45, P303, DOI 10.1111/J.1540-627X.2007.00214.X; CROMIE S, 1985, INT SMALL BUS J, V3, P3; DEPARTMENT OF TRADE AND INDUSTRY, 2005, S AFR WOM ENTR BURG; DEPARTMENT OF TRADE AND INDUSTRY, 2005, SMALL BUS SERV PROM; DEVELOPMENT ALTERNATIVES INC, 2005, GEND PROP GROWTH; DUBINI P, 1989, J BUS VENTURING, V4, P11, DOI 10.1016/0883-9026(89)90031-1; DUCHENAUT B, 1997, OECD C WOM ENTR SMAL; FIELDEN SL, 2003, J SMALL BUSINESS ENT, V10, P152, DOI DOI 10.1108/14626000310473184; FULLER-LOVE N, 2008, FEMALE ENTREPRENEURS; GATEWOOD ELIZABETH, 2002, VENTURE CAPITAL, V4, P305, DOI DOI 10.1080/1369106022000024897; GOSCILO H., 1997, DEHEXING SEX RUSSIAN; GUNNERED BERG N., 2000, INT SMALL BUS J, V18, P38, DOI DOI 10.1177/0266242600182002; GUZMAN J.C., 2007, GENDER ENTREPRENEURS; HISRICH R., 1983, FRONTIERS ENTREPRENE, P255; HISRICH RD, 1984, J SMALL BUS MANAGE, V22, P36; HUTCHINSON P., 1986, SURVIVAL SMALL FIRM; KIBANJA GM, 2009, J AFR BUS, V10, P105, DOI 10.1080/15228910802701544; KIRK J, 2006, J EMPLOYMENT COUNS, V43, P50, DOI 10.1002/J.2161-1920.2006.TB00006.X; KOLVEREID L., 1993, J SMALL BUS MANAGE, V31, P42; MADICHIE NO, 2009, J AFR BUS, V10, P51, DOI 10.1080/15228910802701361; MAHEDA D, 1996, ACTA ACAD, V29, P70; MALHOTRA A, 2002, MEASURING WOMENS EMP; MARLOW S., 2002, INT J ENTREP INNOV, V3, P83, DOI DOI 10.5367/000000002101299088; MARLOW S, 2005, ENTREP THEORY PRACT, V29, P699; MORDI C, 2010, ROLE CULTURAL VALUES; NICHTER S, 2009, SMALL FIRM GROWTH DE; PARKER R., 1995, AFRICAN TECHNICAL DE; PHIRI T, 2003, 6 MCGILL C INT ENTR; RICHARDSON P, 2004, 47 SEED INT LAB ORG; RIDING AL, 1990, J BUS VENTURING, V5, P327, DOI 10.1016/0883-9026(90)90009-I; RUTASHOBYA L. K., 1999, AFRICAN ENTREPRENEUR; RUTASHOBYA LK, 2009, J AFR BUS, V10, P67, DOI 10.1080/15228910802701387; SCHINDEHUTTE M, 2003, J SMALL BUS MANAGE, V41, P94, DOI 10.1111/1540-627X.00069; SCHUTTE JL, 1995, J IND PSYCHOL, V21, P18; SHAW E, 2001, UNEQUAL ENTREPRENEUR; SMALLBONE D, 1990, INT SMALL BUS J, V8, P34; STILL L. V., 2006, WOMEN MANAGEMENT REV, V21, P294, DOI DOI 10.1108/09649420610666597; TAYLOR, 1995, BUSINESS EC MONOGRAP; UNIDO, 2001, 7 UNIDO; VERHEUL I, 2006, ENTREP REGION DEV, V18, P151, DOI 10.1080/08985620500532053; WELTER F., 2006, ENTERPRISING WOMEN T; WOLDIE A, 2004, INT J SOC ECON, V31, P78, DOI DOI 10.1108/03068290410515439","66",5,"5","1","23","ACADEMIC JOURNALS","VICTORIA ISLAND","P O BOX 5170-00200 NAIROBI, VICTORIA ISLAND, LAGOS 73023, NIGERIA","1993-8233",NA,"AFR J BUS MANAGE","AFR. J. BUS. MANAG.",NA,NA,"8","BUSINESS; MANAGEMENT","BUSINESS & ECONOMICS","837UW","ISI000296231100034","2020-02-17","","JUL 4",2011,"5","13","5348","5355",NA,NA,NA,NA,NA,NA,NA,NA,NA,NA,NA,NA,NA,NA,NA,NA,"ISI","UNIV WALES INST UWIC","UNIV WALES INST UWIC",NA,"ADESUA-LINCOLN A, 2011, AFR J BUS MANAGE"
"3","AHMAD SZ, 2015, EQUAL DIVERS INCL","10.1108/EDI-11-2012-0104",2015,0,7,"Strengthening Access To Finance For Women-Owned Smes In Developing Countries","Ahmad, Syed Zamberi; Arif, Afida Mastura Muhammad",NA,NA,"","EQUALITY DIVERSITY AND INCLUSION","2015",2015,34,"7","",NA,"","634","639","","10.1108/EDI-11-2012-0104","","",7,1.17,0,0,0,0,0,0,0,0,0,0,0,0,0,0,0,0,0,0,0,0,0,0,0,0,0,0,0,0,0,0,0,0,2,2,3,0,"J","AHMAD SZ;ARIF AMM","AHMAD, SYED ZAMBERI; ARIF, AFIDA MASTURA MUHAMMAD","EQUALITY DIVERSITY AND INCLUSION","ENGLISH","ARTICLE","GENDER; ENTREPRENEURS; FINANCE; DEVELOPING COUNTRIES; WOMEN-OWNED SMES","ENTREPRENEURS; CREDIT; GENDER","PURPOSE - THE PURPOSE OF THIS PAPER IS TO HIGHLIGHT KEY TRENDS, CHALLENGES, AND OPPORTUNITIES FOR ADVANCING WOMEN'S ENTREPRENEURSHIP AND INCREASING THEIR ACCESS TO FINANCE. DESIGN/METHODOLOGY/APPROACH - DUE TO THEIR HIGH-GROWTH POTENTIAL, WOMEN-OWNED SMES IN DEVELOPING COUNTRIES ARE OF PARTICULAR INTEREST. THE INTERNATIONAL FINANCIAL CORPORATION AND MCKINSEY BUILT A DETAILED DATABASE FOR MICRO-, SMALL-, AND MEDIUM-SIZED ENTERPRISES. THE DATA DERIVED FROM THE READILY AVAILABLE GLOBAL DATA SETS PROVIDE COVERAGE OF A LARGE NUMBER OF COUNTRIES AND NATIONAL STATISTICS. FINDINGS - SINCE FINANCING IS AN IMPORTANT MEANS BY WHICH TO PURSUE GROWTH OPPORTUNITIES, ADDRESSING THE SPECIFIC NEEDS OF WOMEN ENTREPRENEURS (WE) IN ACCESSING FINANCE MUST BE PART OF THE DEVELOPMENT AGENDA. PRACTICAL IMPLICATIONS - THIS PAPER OFFERS VALUABLE PRACTICAL INSIGHTS TO POLICY MAKERS TO ESTABLISH A SUPPORTIVE, ENABLING ENVIRONMENT THAT WILL FACILITATE ACCESS TO FINANCIAL SERVICES FOR WE IN THEIR RESPECTIVE COUNTRIES; LEAD EFFORTS TO IDENTIFY, EVALUATE, AND SUPPORT THE REPLICATION OF SUCCESSFUL MODELS FOR EXPANDING FINANCIAL SERVICES TO WE; AND LEAD EFFORTS TO GATHER GENDER-DISAGGREGATED DATA ON SMALL-, AND MEDIUM-SIZED ENTERPRISE FINANCE IN A COORDINATED FASHION. ORIGINALITY/VALUE - THE VALUE OF THIS PAPER IS THAT IT OFFERS INSIGHTFUL INFORMATION ABOUT KEY TRENDS, CHALLENGES, AND OPPORTUNITIES FOR ADVANCING WOMEN'S ENTREPRENEURSHIP AND INCREASING THEIR ACCESS TO FINANCE.","[AHMAD, SYED ZAMBERI] ABU DHABI UNIV, COLL BUSINESS ADM, MKT & MANAGEMENT DEPT, ABU DHABI, U ARAB EMIRATES.; [ARIF, AFIDA MASTURA MUHAMMAD] UNIV PUTRA MALAYSIA, DEPT RESOURCE MANAGEMENT & CONSUMER STUDIES, FAC HUMAN ECOL, SERDANG, MALAYSIA.","AHMAD, SZ (REPRINT AUTHOR), ABU DHABI UNIV, COLL BUSINESS ADM, MKT & MANAGEMENT DEPT, ABU DHABI, U ARAB EMIRATES.","DRSZAMBERI@YAHOO.COM",NA,NA,"AHMAD SZ, 2011, INT J GEND ENTREP, V3, P123, DOI 10.1108/17566261111140206; ASIEDU E, 2012, AM ECON REV, V102, P532, DOI 10.1257/AER.102.3.532; BARDASI E, 2011, SMALL BUS ECON, V37, P417, DOI 10.1007/S11187-011-9374-Z; BASU A., 1998, J SMALL BUSINESS ENT, V5, P317; BECK T., 2007, FINANCING CONSTRAINT; BEN-HAMIDA E., 2000, EMP WOM MICR CAS STU; BLANCHARD L, 2005, 74 SYR U MAXW SCH CT; BLANCHARD L, 2008, J URBAN ECON, V63, P467, DOI 10.1016/J.JUE.2007.03.001; BLANCHFLOWER DG, 2003, REV ECON STAT, V85, P930, DOI 10.1162/003465303772815835; BRUDER J, 2011, INT J ENTREP BEHAV R, V17, P296, DOI 10.1108/13552551111130727; CARTER S, 2006, NEW HORIZ ENTREP, P373; COLEMAN S., 2002, J DEV ENTREPRENEURSH, V7, P151; HERTZ H., 2011, WOMEN BANKS ARE FEMA; HUNDLEY G, 2001, J LABOR RES, V22, P817, DOI 10.1007/S12122-001-1054-3; INTERNATIONAL FINANCE CORPORATION (IFC), 2011, GLOB SME FIN MAPP 20; KWONG C, 2012, INT J ENTREP BEHAV R, V18, P75, DOI 10.1108/13552551211201385; MAHMOOD S, 2011, INT J GEND ENTREP, V3, P265, DOI 10.1108/17566261111169340; MEAD DC, 1998, WORLD DEV, V26, P61, DOI 10.1016/S0305-750X(97)10010-9; NICHTER S, 2009, WORLD DEV, V37, P1453, DOI 10.1016/J.WORLDDEV.2009.01.013; ROOMI MA, 2008, J ENTREP, V17, P59, DOI 10.1177/097135570701700105; VAN HULTEN A, 2012, INT J GEND ENTREP, V4, P266, DOI 10.1108/17566261211264154","21",7,"8","1","26","EMERALD GROUP PUBLISHING LIMITED","BINGLEY","HOWARD HOUSE, WAGON LANE, BINGLEY BD16 1WA, W YORKSHIRE, ENGLAND","2040-7149","2040-7157","EQUAL DIVERS INCL","EQUAL. DIVERS. INCL.","10.1108/EDI-11-2012-0104",NA,"6","MANAGEMENT","BUSINESS & ECONOMICS","CY6AZ","ISI000366490800006","2020-02-17","",NA,2015,"34","7","634","639","GREEN ACCEPTED",NA,NA,NA,NA,NA,NA,NA,NA,NA,NA,NA,NA,NA,NA,NA,"ISI","ABU DHABI UNIV;UNIV PUTRA MALAYSIA","ABU DHABI UNIV",NA,"AHMAD SZ, 2015, EQUAL DIVERS INCL"
"4","ALDEN L, 2016, KYKLOS","10.1111/KYKL.12101",2016,1,11,"Discrimination In The Credit Market? Access To Financial Capital Among Self-Employed Immigrants","Alden, Lina; Hammarstedt, Mats",NA,NA,"","KYKLOS","FEB 2016",2016,69,"1","",NA,"","3","31","","10.1111/kykl.12101","","",11,2.2,0,0,0,0,0,0,0,0,0,0,0,0,0,0,0,0,0,0,0,0,0,0,0,0,0,0,0,0,0,0,0,0,1,6,4,0,"J","ALDEN L;HAMMARSTEDT M","ALDEN, LINA; HAMMARSTEDT, MATS","KYKLOS","ENGLISH","ARTICLE",NA,"SMALL BUSINESSES; SWEDEN; ENTREPRENEURS; DETERMINANTS; GENDER; RACE","WE PRESENT RESULTS FROM A UNIQUE COMBINATION OF SURVEY AND REGISTER DATA REGARDING ACCESS TO FINANCIAL CAPITAL CONDUCTED AMONG IMMIGRANTS WHO ARE SELF-EMPLOYED IN PRIVATE FIRMS IN SWEDEN'S RETAIL, TRADE, AND SERVICE SECTORS. THIS STUDY IS THE FIRST TO EXAMINE DISCRIMINATION AGAINST SELF-EMPLOYED IMMIGRANTS IN THE CREDIT MARKET OF A DEVELOPED ECONOMY OUTSIDE THE US. THE RESULTS DEMONSTRATE THAT NON-EUROPEAN IMMIGRANTS CONSIDER ACCESS TO FINANCIAL CAPITAL A MORE SERIOUS IMPEDIMENT TO THEIR SELF-EMPLOYMENT ACTIVITIES THAN DO NATIVE SWEDES AND EUROPEAN IMMIGRANTS. SELF-EMPLOYED NON-EUROPEAN IMMIGRANTS REPORT MORE DISCRIMINATION BY BANKS, SUPPLIERS, AND CUSTOMERS THAN DO NATIVES AND IMMIGRANTS FROM EUROPEAN COUNTRIES. IMMIGRANT-OWNED FIRMS APPLY FOR BANK LOANS TO A LARGER EXTENT THAN DO FIRMS OWNED BY NATIVES. NON-EUROPEAN IMMIGRANTS ESPECIALLY ARE MORE LIKELY THAN NATIVES TO HAVE A LOAN DENIED, AND THEY ARE ALSO CHARGED HIGHER INTEREST RATES ON THEIR BANK LOANS THAN NATIVES. THE RESULTS ARE ROBUST TO VARIOUS DIFFERENT ROBUSTNESS CHECKS. THE OCCURRENCE OF ETHNIC DISCRIMINATION IN THE MARKET FOR BANK LOANS IS PUT FORWARD AS AN EXPLANATION FOR THESE RESULTS. LIMITED OR LACK OF ACCESS TO FINANCIAL CAPITAL IS A MAJOR OBSTACLE TO SELF-EMPLOYMENT AMONG CERTAIN IMMIGRANT GROUPS. THIS OBSTACLE MAY BE ONE EXPLANATION FOR THE HIGH EXIT RATES FROM SELF-EMPLOYMENT AMONG IMMIGRANTS, A FINDING THAT HAS BEEN DOCUMENTED IN SEVERAL COUNTRIES INCLUDING SWEDEN.","[ALDEN, LINA; HAMMARSTEDT, MATS] LINNAEUS UNIV, CTR LABOUR MARKET & DISCRIMINAT STUDIES, SE-35195 VAXJO, SWEDEN.","ALDEN, L; HAMMARSTEDT, M (REPRINT AUTHOR), LINNAEUS UNIV, CTR LABOUR MARKET & DISCRIMINAT STUDIES, SE-35195 VAXJO, SWEDEN.","LINA.ALDEN@LNU.SE; MATS.HAMMARSTEDT@LNU.SE","JAN WALLANDER AND TOM HEDELIUS FOUNDATION","ASSOCIATE PROFESSOR LINA ALDEN, CENTRE FOR LABOUR MARKET AND DISCRIMINATION STUDIES, LINNAEUS UNIVERSITY, SE-351 95 VAXJO, SWEDEN, LINA.ALDEN@LNU.SE. PROFESSOR MATS HAMMARSTEDT, CENTRE FOR LABOUR MARKET AND DISCRIMINATION STUDIES, LINNAEUS UNIVERSITY, SE-351 95 VAXJO, SWEDEN, MATS.HAMMARSTEDT@LNU.SE. THE AUTHORS ARE GRATEFUL FOR VALUABLE COMMENTS AND SUGGESTIONS FROM THE ANONYMOUS REFEREE AND FROM THE EDITOR, ALOIS STUTZER. THE AUTHORS ALSO BENEFITED FROM VALUABLE COMMENTS FROM EMILY OSTER. THE AUTHORS FURTHER THANK SEMINAR PARTICIPANTS AT LINNAEUS CENTRE FOR LABOUR MARKET AND DISCRIMINATION STUDIES AT LINNAEUS UNIVERSITY AND SULCIS AT STOCKHOLM UNIVERSITY AND PARTICIPANTS AT THE SNEE CONFERENCE IN MOLLE IN 2014. THE PAPER IS PART OF THE PROJECT ""OBSTACLES AND POSSIBILITIES FOR SELF-EMPLOYMENT AMONG IMMIGRANTS IN THE RETAIL AND TRADE SECTOR"" FUNDED BY THE JAN WALLANDER AND TOM HEDELIUS FOUNDATION. THE AUTHORS APPRECIATE THE FINANCIAL SUPPORT.","AHMED AM, 2008, J URBAN ECON, V64, P362, DOI 10.1016/J.JUE.2008.02.004; AHMED AM, 2010, LAND ECON, V86, P79, DOI 10.3368/LE.86.1.79; ANDERSSON L., 2011, EKONOMISK DEBATT, V39, P31; ANDERSSON L, 2015, INT MIGR, V53, P27, DOI 10.1111/J.1468-2435.2011.00714.X; ANDERSSON L, 2011, REV ECON HOUSEHOLD, V9, P555, DOI 10.1007/S11150-010-9102-5; ANDERSSON L, 2011, INT J MANPOWER, V32, P900, DOI 10.1108/01437721111181660; ANDERSSON L, 2010, SMALL BUS ECON, V34, P261, DOI 10.1007/S11187-008-9117-Y; ANDERSSON-JOONA P., 2010, INT MIGR, V53, P27; ASIEDU E, 2012, AM ECON REV, V102, P532, DOI 10.1257/AER.102.3.532; BATES T, 1999, SMALL BUS ECON, V13, P171, DOI 10.1023/A:1008110421831; BLANCHARD L, 2008, J URBAN ECON, V63, P467, DOI 10.1016/J.JUE.2007.03.001; BLANCHFLOWER DG, 2003, REV ECON STAT, V85, P930, DOI 10.1162/003465303772815835; BLANCHFLOWER DG, 1998, J LABOR ECON, V16, P26, DOI 10.1086/209881; BORJAS G, 1986, J HUM RESOUR, V21, P487; CARLSSON M, 2007, LABOUR ECON, V14, P716, DOI 10.1016/J.LABECO.2007.05.001; CAVALLUZZO KS, 2002, J BUS, V75, P641, DOI 10.1086/341638; CAVALLUZZO KS, 1998, J MONEY CREDIT BANK, V30, P771, DOI 10.2307/2601128; CLARK K, 2000, LABOUR ECON, V7, P603, DOI 10.1016/S0927-5371(00)00015-4; CONSTANT A, 2006, SMALL BUS ECON, V26, P279, DOI 10.1007/S11187-005-3004-6; FAIRLIE RW, 2007, J LABOR ECON, V25, P289, DOI 10.1086/510763; FAIRLIE RW, 1996, J HUM RESOUR, V31, P757, DOI 10.2307/146146; FAIRLIE RW, 1999, J LABOR ECON, V17, P80, DOI 10.1086/209914; HAMMARSTEDT M, 2006, APPL ECON, V38, P619, DOI 10.1080/00036840500397069; HAMMARSTEDT M, 2004, SMALL BUS ECON, V23, P115, DOI 10.1023/B:SBEJ.0000027664.58874.62; HAMMARSTEDT M, 2001, ENTREP REGION DEV, V13, P147, DOI 10.1080/08985620010004106; HAMMARSTEDT M, 2009, KYKLOS, V62, P275, DOI 10.1111/J.1467-6435.2009.00436.X; HOUT M, 2000, J HUM RESOUR, V35, P670, DOI 10.2307/146367; LE AT, 2000, INT MIGR REV, V34, P183, DOI 10.2307/2676017; LOFSTROM M, 2006, HISPANIC SELF EMPLOY; OSTER EMILY, 2015, WORKING PAPER; RATURI M, 1999, ECON DEV CULT CHANGE, V47, P585, DOI 10.1086/452420; ROBB A. M., 2009, J POPUL ECON, V22, P253; STOREY DJ, 2004, SMALL BUS ECON, V23, P401, DOI 10.1007/S11187-004-7259-0; VINOGRADOV E, 2007, ENTREP REGION DEV, V19, P359, DOI 10.1080/08985620701223213; YUENGERT AM, 1995, J HUM RESOUR, V30, P194, DOI 10.2307/146196","35",11,"11","0","18","WILEY-BLACKWELL","HOBOKEN","111 RIVER ST, HOBOKEN 07030-5774, NJ USA","0023-5962","1467-6435","KYKLOS","KYKLOS","10.1111/KYKL.12101",NA,"29","ECONOMICS","BUSINESS & ECONOMICS","DB9LD","ISI000368836500001","2020-02-17","","FEB",2016,"69","1","3","31",NA,NA,NA,NA,NA,NA,NA,NA,NA,NA,NA,NA,NA,NA,NA,NA,"ISI","LINNAEUS UNIV","NOTREPORTED;LINNAEUS UNIV",NA,"ALDEN L, 2016, KYKLOS"
