"","Paper","DOI.x","Year","LCS","GCS","Title","Authors","Corporate.Authors","Editors","Book.Editors","Source.Title","Publication.Date","Publication.Year","Volume","Issue","Part.Number","Supplement","Special.Issue","Beginning.Page","Ending.Page","Article.Number","DOI.y","Conference.Title","Conference.Date","Total.Citations","Average.per.Year","X1985","X1986","X1987","X1988","X1989","X1990","X1991","X1992","X1993","X1994","X1995","X1996","X1997","X1998","X1999","X2000","X2001","X2002","X2003","X2004","X2005","X2006","X2007","X2008","X2009","X2010","X2011","X2012","X2013","X2014","X2015","X2016","X2017","X2018","X2019","X2020","PT","AU","AF","SO","LA","DT","DE","ID","AB","C1","RP","EM","FU","FX","CR","NR","TC","Z9","U1","U2","PU","PI","PA","SN","EI","J9","JI","DI","EA","PG","WC","SC","GA","UT","DA","ER","PD","PY","VL","IS","BP","EP","OA","AR","OI","RI","SI","CT","CY","CL","SP","SU","BE","SE","BN","PN","GP","HO","DB","AU_UN","AU1_UN","AU_UN_NR","SR_FULL"
"68","KIRSCHENMANN K, 2016, J FINANC INTERMED","10.1016/J.JFI.2015.11.001",2016,2,21,"Credit Rationing In Small Firm-Bank Relationships","Kirschenmann, Karolin",NA,NA,"","JOURNAL OF FINANCIAL INTERMEDIATION","APR 2016",2016,26,"","",NA,"","68","99","","10.1016/j.jfi.2015.11.001","","",21,4.2,0,0,0,0,0,0,0,0,0,0,0,0,0,0,0,0,0,0,0,0,0,0,0,0,0,0,0,0,0,0,0,2,10,6,2,1,"J","KIRSCHENMANN K","KIRSCHENMANN, KAROLIN","JOURNAL OF FINANCIAL INTERMEDIATION","ENGLISH","ARTICLE","CREDIT RATIONING; LOAN APPLICATIONS; SMALL FIRM LENDING; ASYMMETRIC INFORMATION","IMPERFECT INFORMATION; LENDING RELATIONSHIPS; FINANCIAL INTERMEDIATION; MARKETS; AVAILABILITY; BUSINESSES; POLICY","I STUDY CREDIT RATIONING IN SMALL FIRM-BANK RELATIONSHIPS BY USING A UNIQUE DATA SET OF MATCHED LOAN APPLICATIONS AND CONTRACTS. I ESTABLISH THE DEGREE OF CREDIT RATIONING BY RELATING A FIRM'S REQUESTED LOAN AMOUNT TO THE BANK'S GRANTED AMOUNT. IN LINE WITH THEORETICAL PREDICTIONS, CREDIT RATIONING IS HIGHER FOR OPAQUE THAN TRANSPARENT FIRMS AT THE BEGINNING OF THEIR BANK RELATIONSHIPS AND DECREASES OVER TIME FOR BOTH. AFTER TESTING FOR SEVERAL ALTERNATIVE EXPLANATIONS, THE RESULTS SUGGEST THAT INFORMATION AND INCENTIVE PROBLEMS EXPLAIN THE OBSERVED CREDIT RATIONING AND ITS DYNAMICS. (C) 2015 ELSEVIER INC. ALL RIGHTS RESERVED.","[KIRSCHENMANN, KAROLIN] AALTO UNIV, SCH BUSINESS, POB 21220, FI-00076 HELSINKI, FINLAND.","KIRSCHENMANN, K (REPRINT AUTHOR), AALTO UNIV, SCH BUSINESS, POB 21220, FI-00076 HELSINKI, FINLAND.","KAROLIN.KIRSCHENMANN@AALTO.FI",NA,NA,"AGARWAL S, 2013, WORKING PAPER; BANERJEE AV, 2014, REV ECON STUD, V81, P572, DOI 10.1093/RESTUD/RDT046; BARBER BM, 2001, Q J ECON, V116, P261, DOI 10.1162/003355301556400; BECCHETTI L, 2011, J MONEY CREDIT BANK, V43, P1217, DOI 10.1111/J.1538-4616.2011.00423.X; BECK T, 2014, 142014 BOFIT; BECK T, 2008, J FINANC ECON, V89, P467, DOI 10.1016/J.JFINECO.2007.10.005; BERG G, 2015, REV FINANC, V19, P951, DOI 10.1093/ROF/RFU022; BERGER AN, 1992, J POLIT ECON, V100, P1047, DOI 10.1086/261851; BERGER AN, 2002, ECON J, V112, PF32, DOI 10.1111/1468-0297.00682; BERGER AN, 1998, J BANK FINANC, V22, P613, DOI 10.1016/S0378-4266(98)00038-7; BESTER H, 1985, AM ECON REV, V75, P850; BHARATH ST, 2011, REV FINANC STUD, V24, P1141, DOI 10.1093/RFS/HHP064; BHATTACHARYA S, 1993, J FINANCIAL INTERMED, V3, P2, DOI DOI 10.1006/JFIN.1993.1001; BOLTON P, 1990, AM ECON REV, V80, P93; BOOT AWA, 2000, J FINANC INTERMED, V9, P7, DOI 10.1006/JFIN.2000.0282; BOOT AWA, 1994, INT ECON REV, V35, P899, DOI 10.2307/2527003; BOYD JH, 1986, J ECON THEORY, V38, P211, DOI 10.1016/0022-0531(86)90115-8; BROWN M, 2011, ECON POLICY, P93, DOI 10.1111/J.1468-0327.2010.00259.X; CHAKRAVARTY S, 2013, J EMPIR FINANC, V20, P63, DOI 10.1016/J.JEMPFIN.2012.09.001; CHENG X., 2010, 2010075 EUR BANK CTR; COLE R., 2013, WORKING PAPER; COLE RA, 1998, J BANK FINANC, V22, P959, DOI 10.1016/S0378-4266(98)00007-7; DEMEZA D, 1992, EUR ECON REV, V36, P1277, DOI 10.1016/0014-2921(92)90032-R; DIAMOND DW, 1984, REV ECON STUD, V51, P393, DOI 10.2307/2297430; ELSAS R, 1998, J BANK FINANC, V22, P1283, DOI 10.1016/S0378-4266(98)00063-6; EUROPEAN COMMISSION, 2011, ACT PLAN IMPR ACC FI; FORT TC, 2013, IMF ECON REV, V61, P520, DOI 10.1057/IMFER.2013.15; GIANNETTI M, 2012, J INT ECON, V86, P167, DOI 10.1016/J.JINTECO.2011.08.005; HERTZBERG A, 2010, J FINANC, V65, P795, DOI 10.1111/J.1540-6261.2010.01553.X; HYYTINEN A, 2008, J BANK FINANC, V32, P1234, DOI 10.1016/J.JBANKFIN.2007.10.006; IFC, 2011, IFC FIN MICROSMALL M; IOANNIDOU V, 2010, J FINANC, V65, P1847, DOI 10.1111/J.1540-6261.2010.01596.X; JAFFEE DM, 1976, Q J ECON, V90, P651, DOI 10.2307/1885327; JIMENEZ G, 2006, J FINANC ECON, V81, P255, DOI 10.1016/J.JFINECO.2005.06.003; JIMENEZ G, 2012, AM ECON REV, V102, P2301, DOI 10.1257/AER.102.5.2301; KJENSTAD EC, 2015, Q REV ECON FINANC, V55, P20, DOI 10.1016/J.QREF.2014.08.001; KYSUCKY V., 2015, MANAGE SCI; LENNEY E, 1977, PSYCHOL BULL, V84, P1; LEVINE R, 2005, HDB EC GROWTH, P865; LIBERTI JM, 2009, REV FINANC STUD, V22, P4057, DOI 10.1093/RFS/HHN118; MESTER LJ, 2007, REV FINANC STUD, V20, P529, DOI 10.1093/RFS/HHL018; NORDEN L, 2010, REV FINANC STUD, V23, P3665, DOI 10.1093/RFS/HHQ061; ODEAN T, 1998, J FINANC, V53, P1887, DOI 10.1111/0022-1082.00078; ONGENA S., 2000, PERFORMANCE FINANCIA; ONGENA S., 2013, WORKING PAPER; PARKER SC, 2003, ECON J, V113, P861, DOI 10.1111/1468-0297.T01-1-00157; PETERSEN MA, 1994, J FINANC, V49, P3, DOI 10.2307/2329133; PETERSEN MA, 1995, Q J ECON, V110, P407, DOI 10.2307/2118445; POPOV A, 2012, J INT ECON, V87, P147, DOI 10.1016/J.JINTECO.2012.01.008; PURI M., 2011, 1395 ECB; PURI M, 2011, J FINANC ECON, V100, P556, DOI 10.1016/J.JFINECO.2010.12.001; RAMAKRISHNAN RTS, 1984, REV ECON STUD, V51, P415, DOI 10.2307/2297431; RAY DEBRAJ, 2001, WORKING PAPER; SOBEL J, 1985, REV ECON STUD, V52, P557, DOI 10.2307/2297732; STEIN JC, 2002, J FINANC, V57, P1891, DOI 10.1111/0022-1082.00483; STIGLITZ JE, 1981, AM ECON REV, V71, P393; UCHIDA H, 2012, J FINANC INTERMED, V21, P97, DOI 10.1016/J.JFI.2011.06.002; WATSON H, 1984, SOUTHERN ECON J, V50, P802, DOI 10.2307/1057994; *WORLD BANK, 2007, FIN ALL POL PITF EXP","59",21,"21","2","29","ACADEMIC PRESS INC ELSEVIER SCIENCE","SAN DIEGO","525 B ST, STE 1900, SAN DIEGO, CA 92101-4495 USA","1042-9573","1096-0473","J FINANC INTERMED","J. FINANC. INTERMED.","10.1016/J.JFI.2015.11.001",NA,"32","BUSINESS, FINANCE","BUSINESS & ECONOMICS","DK2CN","ISI000374722300004","2020-02-17","","APR",2016,"26",NA,"68","99",NA,NA,NA,"KIRSCHENMANN, KAROLIN/G-2291-2013",NA,NA,NA,NA,NA,NA,NA,NA,NA,NA,NA,NA,"ISI","AALTO UNIV","AALTO UNIV",NA,"KIRSCHENMANN K, 2016, J FINANC INTERMED"
"69","KWONG C, 2012, INT J ENTREP BEHAV R","10.1108/13552551211201385",2012,1,29,"Differences In Perceptions Of Access To Finance Between Potential Male And Female Entrepreneurs: Evidence From The Uk","Kwong, Caleb; Jones-Evans, Dylan; Thompson, Piers",NA,NA,"","INTERNATIONAL JOURNAL OF ENTREPRENEURIAL BEHAVIOR & RESEARCH","2012",2012,18,"1","",NA,"","75","+","","10.1108/13552551211201385","","",29,3.22,0,0,0,0,0,0,0,0,0,0,0,0,0,0,0,0,0,0,0,0,0,0,0,0,0,0,0,0,1,1,2,5,9,6,4,1,"J","KWONG C;JONES-EVANS D;THOMPSON P","KWONG, CALEB; JONES-EVANS, DYLAN; THOMPSON, PIERS","INTERNATIONAL JOURNAL OF ENTREPRENEURIAL BEHAVIOR & RESEARCH","ENGLISH","ARTICLE","ENTREPRENEURSHIP; GENDER; FINANCE; SMALL BUSINESS; PERCEPTION; BARRIERS","GENDER; WOMEN; CREDIT; DISCRIMINATION; CRITERIA; MARKETS; CHOICE; WHITE; GAP; SEX","PURPOSE - THE PURPOSE OF THIS STUDY IS TO EXAMINE WHETHER BEING FEMALE INCREASES THE PROBABILITY THAT AN INDIVIDUAL FEELS DIFFICULTY IN OBTAINING FINANCE IS A BARRIER TO STARTING A BUSINESS. THE STUDY AIMS TO EXTEND THIS TO EXAMINE IF A PURE GENDER EFFECT EXISTS OR WHETHER IT IS THE INTERACTION OF GENDER WITH DEMOGRAPHIC, ECONOMIC AND PERCEPTUAL CHARACTERISTICS THAT PLAYS THE MOST IMPORTANT ROLE IN THE PERCEPTION OF FINANCIAL CONSTRAINT. DESIGN/METHODOLOGY/APPROACH - THE DATA WITHIN THIS STUDY ARE DRAWN FROM THE GLOBAL ENTREPRENEURSHIP MONITOR (GEM) ADULT POPULATION SURVEY BETWEEN 2005 AND 2007. THE FIRST STAGE OF THE STUDY SPLITS MALE AND FEMALE RESPONDENTS INTO SEPARATE SUB-SAMPLES AND RUNS INDIVIDUAL REGRESSIONS ON EACH PORTION OF THE SAMPLE. THE SECOND STAGE OF THE STUDY COMBINES THE MALE AND FEMALE PORTIONS OF THE SAMPLE TO DIRECTLY EXAMINE THE DIFFERENCES IN PERCEIVED FINANCIAL CONSTRAINT BETWEEN GENDERS. FINDINGS - THE FINDINGS SUGGEST THAT A GREATER PROPORTION OF WOMEN ARE SOLELY CONSTRAINED BY FINANCIAL BARRIERS THAN THEIR MALE COUNTERPARTS. THE GENDER OF THE RESPONDENT WAS ALSO FOUND TO INTERACT WITH A NUMBER OF OTHER PERSONAL CHARACTERISTICS IN A SIGNIFICANT MANNER. PRACTICAL IMPLICATIONS - THIS FINDING SUGGESTS THAT POLICYMAKERS SHOULD BE ENCOURAGED TO MARKET THE AVAILABILITY OF START-UP FINANCE FROM VARIOUS SOURCES TO ENCOURAGE WOMEN TO ATTEMPT TO OBTAIN THE NECESSARY FINANCE RATHER THAN BEING DISCOURAGED AT THE FIRST HURDLE. ORIGINALITY/VALUE - ALTHOUGH ACTUAL FINANCIAL BARRIERS FACED BY FEMALE ENTREPRENEURS HAVE BEEN EXTENSIVELY STUDIED, THIS IS ONE OF THE FIRST STUDIES TO FOCUS ON THE CONCEPT OF PERCEIVED FINANCIAL CONSTRAINTS FACED BY POTENTIAL FEMALE ENTREPRENEURS.","[KWONG, CALEB] UNIV ESSEX, ENTREPRENEURSHIP & INNOVAT GRP, SOUTHEND ON SEA, ENGLAND.; [JONES-EVANS, DYLAN] UNIV WALES COLL CARDIFF, ENTERPRISE & INNOVAT, CARDIFF, S GLAM, WALES.; [THOMPSON, PIERS] CARDIFF METROPOLITAN UNIV, DEPT ACCOUNTING ECON & FINANCE, CARDIFF, WALES.","KWONG, C (REPRINT AUTHOR), UNIV ESSEX, ENTREPRENEURSHIP & INNOVAT GRP, SOUTHEND ON SEA, ENGLAND.","CKWONG@ESSEX.AC.UK",NA,NA,"AJZEN I, 1991, ORGAN BEHAV HUM DEC, V50, P179, DOI 10.1016/0749-5978(91)90020-T; ALDRICH H. E., 1989, WOMEN OWNED BUSINESS, P103; AMATUCCI FM, 2004, [NO TITLE CAPTURED], V6, P181, DOI DOI 10.1080/1369106042000223579; ATKINSON S.M., 2003, J FINANC RES, V26, P1, DOI DOI 10.1111/1475-6803.00041; BABCOCK L, 2003, WOMEN DONT ASK: NEGOTIATION AND THE GENDER DIVIDE, P1; BAINES S., 2000, GENDER WORK ORGAN, V7, P45, DOI DOI 10.1111/1468-0432.00092; BATES T, 2002, J BUS VENTURING, V17, P313, DOI 10.1016/S0883-9026(00)00066-5; BATES T, 1991, Q REV ECON BUS, V31, P64; BAUM JAC, 2004, J BUS VENTURING, V19, P411, DOI 10.1016/S0883-9026(03)00038-7; BECKER G., 1957, EC DISCRIMINATION; BECKER-BLEASE JR, 2007, J BUS VENTURING, V22, P503, DOI 10.1016/J.JBUSVENT.2006.06.003; BENNETT R., 2000, GENDER WORK ORGAN, V7, P75, DOI DOI 10.1111/1468-0432.00095; BERGER AN, 2007, J SMALL BUS MANAGE, V45, P5, DOI 10.1111/J.1540-627X.2007.00195.X; BLAKE MK, 2006, VENTUR CAP, V8, P183, DOI 10.1080/13691060500433835; BLANCHFLOWER DG, 2003, REV ECON STAT, V85, P930, DOI 10.1162/003465303772815835; BOBBITT-ZEHER D, 2007, SOCIOL EDUC, V80, P1, DOI 10.1177/003804070708000101; BODEN RJ, 2000, J BUS VENTURING, V15, P347, DOI 10.1016/S0883-9026(98)00004-4; BOSMA N. S., 2008, GLOBAL ENTREPRENEURS; BROPHY D., 1992, STATE ART ENTREPRENE, P387; BRUNI A, 2004, GENDER WORK ORGAN, V11, P406, DOI 10.1111/J.1468-0432.2004.00240.X; BRUSH C., 2001, US SMALL BUS ADM OFF; BURT RS, 1992, NETWORKS AND ORGANIZATIONS : STRUCTURE, FORM, AND ACTION, P57; BYGRAVE W. D., 2003, VENTURE CAPITAL, V5, P101, DOI [10.1080/1369106032000097021, DOI 10.1080/1369106032000097021]; CARTER N, 1997, ENTREPRENEURIAL PROC, P163; CARTER N, 1997, [NO TITLE CAPTURED], V9, P211, DOI DOI 10.1080/08985629700000012; CARTER NM, 2003, VENTURE CAPITAL, V5, P1, DOI DOI 10.1080/1369106032000082586; CARTER S., 1998, ENTREP REGION DEV, V10, P225, DOI DOI 10.1080/08985629800000013; CARTER S., 2006, WOMENS BUSINESS OWNE; CARTER S, 2007, ENTREP THEORY PRACT, V31, P427, DOI 10.1111/J.1540-6520.2007.00181.X; CAUSER P, 2009, REGIONAL TRENDS, V41, P31; CAVALLUZZO KS, 2002, J BUS, V75, P641, DOI 10.1086/341638; COLEMAN S, 2000, J SMALL BUS MANAGE, V38, P37; COOK RG, 2007, J SMALL BUS ENTERP D, V14, P241, DOI 10.1108/14626000710746673; CRAVER CHARLES B., 1999, MICH J GENDER L, V5, P299; CROSON R, 2009, J ECON LIT, V47, P448, DOI 10.1257/JEL.47.2.448; DE BRUIN A, 2005, INT J ENTREP BEHAV R, V11, P108, DOI 10.1108/13552550510590536; DUNCAN C, 2004, GENDER WORK ORGAN, V11, P95, DOI 10.1111/J.1468-0432.2004.00222.X; EVANS DS, 1989, J POLIT ECON, V97, P808, DOI 10.1086/261629; FAY M, 1993, J BUS VENTURING, V8, P363, DOI 10.1016/0883-9026(93)90005-P; FAY M., 1991, AUSTR J MANAGEMENT, V16, P65; HARDING R., 2007, STATE WOMENS ENTERPR; HILL FM, 2006, VENTUR CAP, V8, P159, DOI 10.1080/13691060600555347; HOANG H, 2003, J BUS VENTURING, V18, P165, DOI 10.1016/S0883-9026(02)00081-2; IBARRA H, 1992, ADMIN SCI QUART, V37, P422, DOI 10.2307/2393451; JONES-EVANS D., 2008, GLOBAL ENTREPRENEURS; JONES-EVANS D, 2011, REG STUD, V45, P219, DOI 10.1080/00343400903241493; JONES-EVANS D, 2009, EUR PLAN STUD, V17, P659, DOI 10.1080/09654310902782138; KIHLSTROM RE, 1979, J POLIT ECON, V87, P719, DOI 10.1086/260790; KON Y, 2003, SMALL BUS ECON, V21, P37, DOI 10.1023/A:1024447603600; KWONG C., 2006, 29 I SMALL BUS ENTR; KWONG C., 2009, INT J ENTREPRENEURIA, V15, P1355; LEWIS P, 2006, GENDER WORK ORGAN, V13, P453, DOI 10.1111/J.1468-0432.2006.00317.X; LOURY LD, 1997, IND LABOR RELAT REV, V50, P580, DOI 10.2307/2525263; MANNING A., 2008, ECON J, V113, P983; MANNING A, 2008, ECON J, V118, PF28, DOI 10.1111/J.1468-0297.2007.02115.X; MARLOW S, 2005, ENTREP THEORY PRACT, V29, P717, DOI 10.1111/J.1540-6520.2005.00105.X; MARLOW S, 1997, ENTREP REGION DEV, V9, P199, DOI DOI 10.1080/08985629700000011; MARTIN LM, 2005, INT J ENTREP BEHAV R, V11, P162, DOI 10.1108/13552550510590563; MCCLELLAND E, 2005, INT J ENTREP BEHAV R, V11, P84, DOI 10.1108/13552550510590527; MCGREGOR J., 2002, WORK ORG, V9, P420, DOI DOI 10.1111/1468-0432.00167; MCKECHNIE SA, 1998, INT SMALL BUS J, V16, P39; MIRCHANDANI K., 1999, GENDER WORK ORGAN, V6, P224, DOI DOI 10.1111/1468-0432.00085; MOORE DP, 1997, WOMEN ENTREPRENEURS; ORHAN M, 2001, J SMALL BUS MANAGE, V39, P95, DOI 10.1111/0447-2778.00009; ORSER B., 1994, WOMEN MANAGEMENT REV, V9, P11, DOI DOI 10.1108/09649429410062211; POWELL P., 1994, BRIT J MANAGE, V5, P123, DOI DOI 10.1111/J.1467-8551.1994.TB00073.X; REYNOLDS P, 2005, SMALL BUS ECON, V24, P205, DOI 10.1007/S11187-005-1980-1; ROPER S, 2009, INT SMALL BUS J, V27, P149, DOI 10.1177/0266242608100488; SHAW E., 2005, 28 I SMALL BUS ENTR; STEBRO T., 2003, J ECON BUS, V55, P303, DOI DOI 10.1016/S0148-6195(03)00029-8; STIGLITZ JE, 1981, AM ECON REV, V71, P393; THOMPSON P, 2010, INT SMALL BUS J, V28, P147, DOI 10.1177/0266242609355858; THOMPSON P, 2009, INT SMALL BUS J, V27, P227, DOI 10.1177/0266242608100492; VOS E, 2007, J BANK FINANC, V31, P2648, DOI 10.1016/J.JBANKFIN.2006.09.011; WATSON J, 2005, INT J ENTREP BEHAV R, V11, P129, DOI 10.1108/13552550510590545; WEILER S, 2001, SOC SCI J, V38, P85, DOI 10.1016/S0362-3319(00)00111-7; XU B, 1998, ECON LETT, V58, P91, DOI 10.1016/S0165-1765(97)00255-3","77",29,"29","3","18","EMERALD GROUP PUBLISHING LTD","BINGLEY","HOWARD HOUSE, WAGON LANE, BINGLEY BD16 1WA, W YORKSHIRE, ENGLAND","1355-2554","1758-6534","INT J ENTREP BEHAV R","INT. J. ENTREP. BEHAV. RES.","10.1108/13552551211201385",NA,"25","BUSINESS; MANAGEMENT","BUSINESS & ECONOMICS","V71WD","ISI000211603400004","2020-02-17","",NA,2012,"18","1","75","+",NA,NA,"THOMPSON, PIERS/0000-0003-1961-7441","THOMPSON, PIERS/R-5828-2019",NA,NA,NA,NA,NA,NA,NA,NA,NA,NA,NA,NA,"ISI","UNIV ESSEX;UNIV WALES COLL CARDIFF;CARDIFF METROPOLITAN UNIV","UNIV ESSEX",NA,"KWONG C, 2012, INT J ENTREP BEHAV R"
"70","LADD HF, 1998, J ECON PERSPECT","10.1257/JEP.12.2.41",1998,2,143,"Evidence On Discrimination In Mortgage Lending","Ladd, HF",NA,NA,"","JOURNAL OF ECONOMIC PERSPECTIVES","SPR 1998",1998,12,"2","",NA,"","41","62","","10.1257/jep.12.2.41","","",143,6.22,0,0,0,0,0,0,0,0,0,0,0,0,0,2,3,7,8,5,9,5,9,6,9,7,5,5,7,6,2,10,7,8,8,7,8,0,"J","LADD HF","LADD, HF","JOURNAL OF ECONOMIC PERSPECTIVES","ENGLISH","ARTICLE",NA,"BOSTON","MUCH OF THE CONTROVERSY ABOUT WHETHER MORTGAGE LENDERS DISCRIMINATE AGAINST MINORITIES CAN BE EXPLAINED IN TERMS OF THE CONFUSION ABOUT HOW TO DEFINE DISCRIMINATION. BASED ON THE LEGAL DEFINITION, CAREFUL STUDIES OF LOAN DENIAL RATES, SUCH AS THAT DONE BY THE FEDERAL RESERVE BANK OF BOSTON, REPRESENT AN APPROPRIATE METHOD FOR TESTING FOR DISCRIMINATION BY LENDERS. BASED ON THAT STUDY, IT IS QUITE CLEAR THAT LENDERS DISCRIMINATE. THE FACT THAT MINORITIES HAVE HIGHER DEFAULT RATES ON AVERAGE THAN WHITES IS IRRELEVANT TO THE INTERPRETATION OF THE RACE COEFFICIENT IN SUCH MODELS. NONETHELESS, MORE RESEARCH ON AND DISCUSSION ABOUT THE RELATIONSHIP BETWEEN THE RACE OF THE APPLICANT AND DELINQUENCIES, DEFAULTS, AND LOSSES WOULD BE DESIRABLE.","DUKE UNIV, SANFORD INST PUBL POLICY, DURHAM, NC 27710 USA.","LADD, HF (REPRINT AUTHOR), DUKE UNIV, SANFORD INST PUBL POLICY, DURHAM, NC 27710 USA.","LADD@PPS.DUKE.EDU",NA,NA,"ARROW KJ, 1973, DISCRIMINATION LABOR, P3; BECKER G, 1993, BUSINESS WEEK 0419; BECKER G., 1971, EC DISCRIMINATION; BENSTON GJ, 1991, J FINANCIAL SERVICES, V5, P235; BERKOVEC J, 1995, DISCRIMINATION DEFAU; BERKOVEC J., 1996, CITYSCAPE J POLICY D, V2, P9; BERKOVEC J. A., 1996, MORTGAGE LENDING RAC, P251; BERKOVEC JA, 1994, J REAL ESTATE FINANC, V9, P263, DOI 10.1007/BF01099279; BERKOVEC JA, 1996, CITYSCAPE J POLICY D, V2, P49; BERKOVEC JA, IN PRESS REV EC STAT; BOSTIC RAPHAEL W., 1996, ROLE RACE MORTGAGE L, P19; BREUCKNER JK, 1996, CITYSCAPE J POLICY D, V2, P65; BROWNE LE, 1995, NEW ENGL ECON REV, P53; CALOMIRIS CW, 1994, J MONEY CREDIT BANK, V26, P634, DOI 10.2307/2077996; CARR J, 1993, RES NOTES FEDERA RES; CARTER R, 1996, COMMUNITIES BANK FAL; DUNHAM C. R., 1989, NEW ENGL ECON REV, P3; EVANS RD, 1985, Q J BUSINESS EC, P75; GALSTER G, 1993, CLEAR CONVINCING EVI, P285; GALSTER G, 1996, MORTGAGE LENDING RAC, P679; GOERING JM, 1996, [NO TITLE CAPTURED]; HORNE D, 1994, FDIC BANKING REV SPR, P1; HUNTER WC, 1996, J REAL ESTATE FINANC, V13, P57; LADD HF, 1982, AM ECON REV, V72, P166; MUNNELL AH, 1996, AM ECON REV, V86, P25; MUNNELL AH, IS DISCRIMINATION RA; PHELPS ES, 1972, AM ECON REV, V62, P659; QUERCIA RG, 1992, J HOUSING RES, V3, P341; RACHEL LAWTON, 1996, MORTGAGE LENDING RAC, P611; ROSS S, 1996, CITYSCAPE J POLICY D, V2, P41; ROSS S, IN PRESS J HOUSING E; SCHAFER R, 1981, DISCRIMINATION MORTG; SCHILL M. H., 1993, J HOUSING RES, V4, P245; SMITH SL, 1996, MORTGAGE LENDING RAC, P589; SPENSER LESLIE, 1993, FORBES 0104; STENGEL M, 1995, 953 OFF COMPT CURR E; STENGEL M, 1994, 952 COMPT CURR; TOOTELL GMB, 1996, MORTGAGE LENDING RAC, P143; TOOTELL GMB, 1993, NEW ENGL ECON REV, P45; VANORDER R, 1993, EFFECTS RACIAL COMPO; YEZER AMJ, 1994, J REAL ESTATE FINANC, V9, P197, DOI 10.1007/BF01099273; YINGER J, 1986, AM ECON REV, V76, P881; YINGER J, 1996, MORTGAGE LENDING RAC, P29; YINGER J., 1996, CITYSCAPE, V2, P25; ZANDI M, 1993, AM BANKER 0819","45",143,"144","1","14","AMER ECONOMIC ASSOC","NASHVILLE","2014 BROADWAY, STE 305, NASHVILLE, TN 37203 USA","0895-3309","1944-7965","J ECON PERSPECT","J. ECON. PERSPECT.","10.1257/JEP.12.2.41",NA,"22","ECONOMICS","BUSINESS & ECONOMICS","ZP467","ISI000073756400003","2020-02-17","","SPR",1998,"12","2","41","62",NA,NA,NA,NA,NA,NA,NA,NA,NA,NA,NA,NA,NA,NA,NA,NA,"ISI","DUKE UNIV","DUKE UNIV",NA,"LADD HF, 1998, J ECON PERSPECT"
"71","LASHITEW AA, 2014, KYKLOS","10.1111/KYKL.12051",2014,0,3,"The Effect Of Political Connections On Credit Access: Does The Level Of Financial Development Matter?","Lashitew, Addisu A.",NA,NA,"","KYKLOS","MAY 2014",2014,67,"2","",NA,"","227","254","","10.1111/kykl.12051","","",3,0.43,0,0,0,0,0,0,0,0,0,0,0,0,0,0,0,0,0,0,0,0,0,0,0,0,0,0,0,0,0,0,0,0,1,2,0,0,"J","LASHITEW AA","LASHITEW, ADDISU A.","KYKLOS","ENGLISH","ARTICLE",NA,"FIRM PERFORMANCE; ALLOCATION; INFORMATION; COMPETITION; OWNERSHIP; MARKETS; GROWTH; CHINA","ALTHOUGH GROWING EVIDENCE INDICATES THAT POLITICAL CONNECTIONS AFFECT FIRM PERFORMANCE, LITTLE IS KNOWN HOW INSTITUTIONAL FACTORS MODERATE THE PROCESS. THIS PAPER INVESTIGATES THE EFFECT OF POLITICAL CONNECTIONS ON CREDIT ACCESS, AND THE ROLE OF FINANCIAL DEVELOPMENT IN MODERATING THE RELATIONSHIP BETWEEN THE TWO. THE ANALYSIS IS BASED ON A UNIQUE DATASET OF MANUFACTURING FIRMS THAT COVERS DOZENS OF DEVELOPING AND TRANSITION COUNTRIES. THE RESULTS SHOW THAT THE STRENGTH OF POLITICAL CONNECTIONS, MEASURED BY THE AMOUNT OF TIME THE FIRM'S SENIOR MANAGERS SPEND WITH GOVERNMENT OFFICIALS, HAS A SIGNIFICANT POSITIVE EFFECT ON CREDIT ACCESS. EXPLOITING THE CROSS-COUNTRY DIMENSION OF THE DATASET, I THEN SHOW THAT THE EFFECT OF POLITICAL CONNECTIONS IS HIGHER IN COUNTRIES WHERE THE BANKING SECTOR IS MORE CONCENTRATED AND HAS HIGHER NET INTEREST MARGIN. FURTHERMORE, THE EFFECT OF POLITICAL CONNECTIONS IS LOWER IN COUNTRIES THAT HAVE CREDIT INFORMATION SHARING MECHANISMS. THESE RESULTS SUGGEST THAT A COMPETITIVE BANKING SECTOR IMPROVES EFFICIENCY OF CREDIT ALLOCATION BY REDUCING POLITICALLY MOTIVATED LENDING.","UNIV GRONINGEN, NL-9700 AV GRONINGEN, NETHERLANDS.","LASHITEW, AA (REPRINT AUTHOR), UNIV GRONINGEN, POB 800, NL-9700 AV GRONINGEN, NETHERLANDS.","A.A.LASHITEW@RUG.NL",NA,NA,"ABIAD A, 2008, J DEV ECON, V87, P270, DOI 10.1016/J.JDEVECO.2007.12.002; AI CR, 2003, ECON LETT, V80, P123, DOI 10.1016/S0165-1765(03)00032-6; AMEMIYA T, 1984, J ECONOMETRICS, V24, P3, DOI 10.1016/0304-4076(84)90074-5; BANERJEE AV, 2005, HANDB ECON, V22, P473; BARTH J.R., 2008, WORLD BANK POLICY RE, V4646; BECK T, 2004, J MONEY CREDIT BANK, V36, P627, DOI 10.1353/MCB.2004.0039; BECK T, 2010, WORLD BANK ECON REV, V24, P77, DOI 10.1093/WBER/LHP016; BRANDT L, 2003, J COMP ECON, V31, P387, DOI 10.1016/S0147-5967(03)00080-5; BROWN M, 2009, J FINANC INTERMED, V18, P151, DOI 10.1016/J.JFI.2008.04.002; CETORELLI N, 2001, J FINANC, V56, P617, DOI 10.1111/0022-1082.00339; CLAESSENS S, 2008, J FINANC ECON, V88, P554, DOI 10.1016/J.JFINECO.2006.11.003; DJANKOV S, 2007, J FINANC ECON, V84, P299, DOI 10.1016/J.JFINECO.2006.03.004; DU J, 2010, KYKLOS, V63, P530, DOI 10.1111/J.1467-6435.2010.00486.X; FACCIO M, 2006, AM ECON REV, V96, P369, DOI 10.1257/000282806776157704; FIRTH M, 2009, J BANK FINANC, V33, P1144, DOI 10.1016/J.JBANKFIN.2008.12.008; FRYE TM, 2011, EUR J POLIT ECON, V27, P642, DOI 10.1016/J.EJPOLECO.2011.06.003; GONZALEZ-PARAMO JM, 2005, KYKLOS, V58, P495, DOI 10.1111/J.0023-5962.2005.00299.X; GREENE W, 2010, ECON LETT, V107, P291, DOI 10.1016/J.ECONLET.2010.02.014; HSIEH CT, 2009, Q J ECON, V124, P1403, DOI 10.1162/QJEC.2009.124.4.1403; HUBBARD RG, 1998, J ECON LIT, V36, P193; KALI R, 1999, J LAW ECON ORGAN, V15, P615, DOI 10.1093/JLEO/15.3.615; KHWAJA AI, 2005, Q J ECON, V120, P1371, DOI 10.1162/003355305775097524; LA PORTA R, 2002, J FINANC, V57, P265, DOI 10.1111/1540-6261.00422; LAMBSDORFF JG, 2003, KYKLOS, V56, P457, DOI 10.1046/J.0023-5962.2003.00233.X; LI HB, 2008, J DEV ECON, V87, P283, DOI 10.1016/J.JDEVECO.2007.03.001; LI HB, 2006, ECON INQ, V44, P559, DOI 10.1093/EI/CBJ031; MEGGINSON WL, 2005, J BANK FINANC, V29, P1931, DOI 10.1016/J.JBANKFIN.2005.03.005; SCHIANTARELLI FABIO, 1995, BOSTON COLL WORKING, V293; WURGLER J, 2000, J FINANC ECON, V58, P187, DOI 10.1016/S0304-405X(00)00070-2","29",3,"3","0","14","WILEY","HOBOKEN","111 RIVER ST, HOBOKEN 07030-5774, NJ USA","0023-5962","1467-6435","KYKLOS","KYKLOS","10.1111/KYKL.12051",NA,"28","ECONOMICS","BUSINESS & ECONOMICS","AI9TG","ISI000337279300005","2020-02-17","","MAY",2014,"67","2","227","254",NA,NA,NA,"LASHITEW, ADDISU/K-7625-2019",NA,NA,NA,NA,NA,NA,NA,NA,NA,NA,NA,NA,"ISI","UNIV GRONINGEN","UNIV GRONINGEN",NA,"LASHITEW AA, 2014, KYKLOS"
