Title,Authors,Corporate Authors,Editors,Book Editors,Source Title,Publication Date,Publication Year,Volume,Issue,Part Number,Supplement,Special Issue,Beginning Page,Ending Page,Article Number,DOI,Conference Title,Conference Date,Total Citations,Average per Year,1985,1986,1987,1988,1989,1990,1991,1992,1993,1994,1995,1996,1997,1998,1999,2000,2001,2002,2003,2004,2005,2006,2007,2008,2009,2010,2011,2012,2013,2014,2015,2016,2017,2018,2019,2020
Determinants of Microfinance institutions' access to bank credit in Senegal,"Fall, Francois Seck",,,,ECONOMICS BULLETIN,2017,2017,37,2,,,,1327,+,,,,,0,0,0,0,0,0,0,0,0,0,0,0,0,0,0,0,0,0,0,0,0,0,0,0,0,0,0,0,0,0,0,0,0,0,0,0,0,0
Micro determinants of the extent of credit rationing amongst SMEs in Ghana,"Domeher, Daniel; Musah, Godwin; Poku, Kwasi",,,,INTERNATIONAL JOURNAL OF SOCIAL ECONOMICS,2017,2017,44,12,,,,1796,1817,,10.1108/IJSE-03-2016-0089,,,0,0,0,0,0,0,0,0,0,0,0,0,0,0,0,0,0,0,0,0,0,0,0,0,0,0,0,0,0,0,0,0,0,0,0,0,0,0
WOMEN ENTREPRENEURS AND ACCESS TO CREDIT IN DEVELOPING COUNTRIES: THE NIGERIAN EXPERIENCE,"Onah, Roseline C.",,,,PAPER PROCEEDINGS OF ADVANCES IN WOMEN'S STUDIES 2016,2016,2016,,,,,,75,82,,,3rd International Conference on Advances in Women's Studies (AWS),"JUL 30-31, 2016",0,0,0,0,0,0,0,0,0,0,0,0,0,0,0,0,0,0,0,0,0,0,0,0,0,0,0,0,0,0,0,0,0,0,0,0,0,0
ACCESS TO FORMAL CREDIT AND ENTERPRISE PERFORMANCE IN NIGERIA: A GENDER PERSPECTIVE,"Nwosu, Emmanuel O.; Orji, Anthony",,,,ARGUMENTA OECONOMICA,2016,2016,36,1,,,,191,224,,10.15611/aoe.2016.1.08,,,0,0,0,0,0,0,0,0,0,0,0,0,0,0,0,0,0,0,0,0,0,0,0,0,0,0,0,0,0,0,0,0,0,0,0,0,0,0
Access to Bank Credit During the Economic Crisis: A Comparison Between Italian Male and Female Entrepreneurs,"Cesaroni, Francesca Maria; Sentuti, Annalisa",,,"Dameri, RP; Garelli, R; Resta, M; Beltrametti, L",PROCEEDINGS OF THE 10TH EUROPEAN CONFERENCE ON INNOVATION AND ENTREPRENEURSHIP (ECIE 2015),2015,2015,,,,,,121,129,,,10th European Conference on Innovation and Entrepreneurship (ECIE),"SEP 17-18, 2015",0,0,0,0,0,0,0,0,0,0,0,0,0,0,0,0,0,0,0,0,0,0,0,0,0,0,0,0,0,0,0,0,0,0,0,0,0,0
Credit Access and Urban Regeneration in the United States,"Dyer, Alan W.",,,"Bevilacqua, C; Calabro, F; Spina, LD",NEW METROPOLITAN PERSPECTIVES: THE INTEGRATED APPROACH OF URBAN SUSTAINABLE DEVELOPMENT,2014,2014,11,,,,,344,347,,10.4028/www.scientific.net/AEF.11.344,1st International Symposium on New Metropolitan Perspectives -The Integrated Approach of Urban Sustainable Development through the Implementation of Horizon (ISTH)/Europe 2020,"MAY 06-08, 2014",0,0,0,0,0,0,0,0,0,0,0,0,0,0,0,0,0,0,0,0,0,0,0,0,0,0,0,0,0,0,0,0,0,0,0,0,0,0
