Title,Authors,Corporate Authors,Editors,Book Editors,Source Title,Publication Date,Publication Year,Volume,Issue,Part Number,Supplement,Special Issue,Beginning Page,Ending Page,Article Number,DOI,Conference Title,Conference Date,Total Citations,Average per Year,1985,1986,1987,1988,1989,1990,1991,1992,1993,1994,1995,1996,1997,1998,1999,2000,2001,2002,2003,2004,2005,2006,2007,2008,2009,2010,2011,2012,2013,2014,2015,2016,2017,2018,2019,2020
Are Women CEOs Valuable in Terms of Bank Loan Costs? Evidence from China,"Luo, Jin-hui; Huang, Zeyue; Li, Xue; Lin, Xiaojing",,,,JOURNAL OF BUSINESS ETHICS,DEC 2018,2018,153,2,,,,337,355,,10.1007/s10551-016-3369-2,,,4,1.33,0,0,0,0,0,0,0,0,0,0,0,0,0,0,0,0,0,0,0,0,0,0,0,0,0,0,0,0,0,0,0,0,0,1,3,0
The effect of the political connections of government bank CEOs on bank performance during the financial crisis,"Chen, Hung-Kun; Liao, Yin-Chi; Lin, Chih-Yung; Yen, Ju-Fang",,,,JOURNAL OF FINANCIAL STABILITY,JUN 2018,2018,36,,,,,130,143,,10.1016/j.jfs.2018.02.010,,,4,1.33,0,0,0,0,0,0,0,0,0,0,0,0,0,0,0,0,0,0,0,0,0,0,0,0,0,0,0,0,0,0,0,0,0,1,3,0
Determinants of SME Finance: Evidence from Three Central European Countries,"Rahman, Ashiqur; Rahman, M. Twyeafur; Belas, Jaroslav",,,,REVIEW OF ECONOMIC PERSPECTIVES,SEP 2017,2017,17,3,,,,263,285,,10.1515/revecp-2017-0014,,,4,1,0,0,0,0,0,0,0,0,0,0,0,0,0,0,0,0,0,0,0,0,0,0,0,0,0,0,0,0,0,0,0,0,0,3,1,0
"Lobbying, political connections and emergency lending by the Federal Reserve","Blau, Benjamin M.",,,,PUBLIC CHOICE,SEP 2017,2017,172,3-4,,,,333,358,,10.1007/s11127-017-0446-8,,,4,1,0,0,0,0,0,0,0,0,0,0,0,0,0,0,0,0,0,0,0,0,0,0,0,0,0,0,0,0,0,0,0,0,0,1,3,0
Family ties and access to finance in an Islamic environment,"Mertzanis, Charilaos",,,,JOURNAL OF INTERNATIONAL FINANCIAL MARKETS INSTITUTIONS & MONEY,MAY 2017,2017,48,,,,,1,24,,10.1016/j.intfin.2016.12.001,,,4,1,0,0,0,0,0,0,0,0,0,0,0,0,0,0,0,0,0,0,0,0,0,0,0,0,0,0,0,0,0,0,0,0,0,0,4,0
Addressing Poverty and Gender Inequality through Access to Formal Credit and Enhanced Enterprise Performance in Nigeria: An Empirical Investigation,"Nwosu, Emmanuel O.; Orji, Anthony",,,,AFRICAN DEVELOPMENT REVIEW-REVUE AFRICAINE DE DEVELOPPEMENT,FEB 2017,2017,29,,,1,SI,56,72,,10.1111/1467-8268.12233,,,4,1,0,0,0,0,0,0,0,0,0,0,0,0,0,0,0,0,0,0,0,0,0,0,0,0,0,0,0,0,0,0,0,0,1,1,2,0
DOES MICROFINANCE ENHANCE GENDER EQUITY IN ACCESS TO FINANCE? EVIDENCE FROM PAKISTAN,"Zulfiqar, Ghazal",,,,FEMINIST ECONOMICS,JAN 2017,2017,23,1,,,,160,185,,10.1080/13545701.2016.1193213,,,4,1,0,0,0,0,0,0,0,0,0,0,0,0,0,0,0,0,0,0,0,0,0,0,0,0,0,0,0,0,0,0,0,0,1,1,2,0
The Determinants of Firm Access to Credit in Latin America: Micro Characteristics and Market Structure,"Presbitero, Andrea F.; Rabellotti, Roberta",,,,ECONOMIC NOTES,NOV 2016,2016,45,3,,,SI,445,472,,10.1111/ecno.12069,,,4,0.8,0,0,0,0,0,0,0,0,0,0,0,0,0,0,0,0,0,0,0,0,0,0,0,0,0,0,0,0,0,0,0,0,0,1,3,0
Credit constraints and their impact on farm household welfare Evidence from Vietnam's North Central Coast region,"Minh Chau Tran; Gan, Christopher; Hu, Baiding",,,,INTERNATIONAL JOURNAL OF SOCIAL ECONOMICS,2016,2016,43,8,,,,782,803,,10.1108/IJSE-11-2014-0243,,,4,0.8,0,0,0,0,0,0,0,0,0,0,0,0,0,0,0,0,0,0,0,0,0,0,0,0,0,0,0,0,0,0,0,0,1,1,2,0
Gender Bias Claims in Farm Service Agency's Lending Decisions,"Escalante, Cesar L.; Epperson, James E.; Raghunathan, Uthra",,,,JOURNAL OF AGRICULTURAL AND RESOURCE ECONOMICS,AUG 2009,2009,34,2,,,,332,349,,,,,4,0.33,0,0,0,0,0,0,0,0,0,0,0,0,0,0,0,0,0,0,0,0,0,0,0,0,0,0,0,1,0,0,0,0,0,2,1,0
Credit market access in Uganda: Evidence from household survey data 1999/2000,"Okurut, F. N.; Schoombee, A.",,,,SOUTH AFRICAN JOURNAL OF ECONOMIC AND MANAGEMENT SCIENCES,SEP 2007,2007,10,3,,,,371,383,,,,,4,0.29,0,0,0,0,0,0,0,0,0,0,0,0,0,0,0,0,0,0,0,0,0,0,0,0,1,1,0,0,0,0,0,0,2,0,0,0
"Access to Rural Credit Markets in Developing Countries, the Case of Vietnam: A Literature Review","Ta Nhat Linh; Hoang Thanh Long; Le Van Chi; Le Thanh Tam; Lebailly, Philippe",,,,SUSTAINABILITY,MAR 1 2019,2019,11,5,,,,,,1468,10.3390/su11051468,,,3,1.5,0,0,0,0,0,0,0,0,0,0,0,0,0,0,0,0,0,0,0,0,0,0,0,0,0,0,0,0,0,0,0,0,0,0,3,0
Does credit access lead to expansion of income and multidimensional poverty? A study of rural Assam,"Das, Tiken",,,,INTERNATIONAL JOURNAL OF SOCIAL ECONOMICS,FEB 11 2019,2019,46,2,,,,252,270,,10.1108/IJSE-12-2017-0592,,,3,1.5,0,0,0,0,0,0,0,0,0,0,0,0,0,0,0,0,0,0,0,0,0,0,0,0,0,0,0,0,0,0,0,0,0,0,2,1
Appearing self-confident and getting credit for it: Why it may be easier for men than women to gain influence at work,"Guillen, Laura; Mayo, Margarita; Karelaia, Natalia",,,,HUMAN RESOURCE MANAGEMENT,JUL-AUG 2018,2018,57,4,,,SI,839,854,,10.1002/hrm.21857,,,3,1,0,0,0,0,0,0,0,0,0,0,0,0,0,0,0,0,0,0,0,0,0,0,0,0,0,0,0,0,0,0,0,0,0,2,1,0
Gender differences in formal credit approaches: rural households in Vietnam,"Thi Kieu Van Tran; Elahi, Ehsan; Zhang, Liqin; Abid, Muhammad; Quang Trung Pham; Thuy Duong Tran",,,,ASIAN-PACIFIC ECONOMIC LITERATURE,MAY 2018,2018,32,1,,,,131,138,,10.1111/apel.12220,,,3,1,0,0,0,0,0,0,0,0,0,0,0,0,0,0,0,0,0,0,0,0,0,0,0,0,0,0,0,0,0,0,0,0,0,1,2,0
Does ownership matter in access to bank credit in China?,"Gou, Qin; Huang, Yiping; Xu, Jianguo",,,,EUROPEAN JOURNAL OF FINANCE,2018,2018,24,16,,,SI,1409,1427,,10.1080/1351847X.2016.1190391,4th Conference on the Chinese Capital Markets,"MAY 24-26, 2014",3,1,0,0,0,0,0,0,0,0,0,0,0,0,0,0,0,0,0,0,0,0,0,0,0,0,0,0,0,0,0,0,0,0,0,1,2,0
Can firms with political connections borrow more than those without? Evidence from firm-level data for Indonesia,"Fu, Jiangtao; Shimamoto, Daichi; Todo, Yasuyuki",,,,JOURNAL OF ASIAN ECONOMICS,OCT 2017,2017,52,,,,,45,55,,10.1016/j.asieco.2017.08.003,,,3,0.75,0,0,0,0,0,0,0,0,0,0,0,0,0,0,0,0,0,0,0,0,0,0,0,0,0,0,0,0,0,0,0,0,0,1,2,0
Gender Discrimination in Microfinance? Some Evidence from Uganda,"Corsi, Marcella; De Angelis, Marina",,,,JOURNAL OF DEVELOPMENT STUDIES,2017,2017,53,5,,,SI,723,740,,10.1080/00220388.2016.1205733,,,3,0.75,0,0,0,0,0,0,0,0,0,0,0,0,0,0,0,0,0,0,0,0,0,0,0,0,0,0,0,0,0,0,0,0,1,0,2,0
The Effect of Political Connections on Credit Access: Does the Level of Financial Development Matter?,"Lashitew, Addisu A.",,,,KYKLOS,MAY 2014,2014,67,2,,,,227,254,,10.1111/kykl.12051,,,3,0.43,0,0,0,0,0,0,0,0,0,0,0,0,0,0,0,0,0,0,0,0,0,0,0,0,0,0,0,0,0,0,0,0,1,2,0,0
ARE WOMEN MORE LIKELY TO BE CREDIT CONSTRAINED? EVIDENCE FROM LOW-INCOME URBAN HOUSEHOLDS IN THE PHILIPPINES,"Malapit, Hazel Jean L.",,,,FEMINIST ECONOMICS,2012,2012,18,3,,,,81,108,,10.1080/13545701.2012.716161,,,3,0.33,0,0,0,0,0,0,0,0,0,0,0,0,0,0,0,0,0,0,0,0,0,0,0,0,0,0,0,0,1,0,0,1,1,0,0,0
How individual's characteristics influence financial inclusion: evidence from MENAP,"Shihadeh, Fadi Hassan",,,,INTERNATIONAL JOURNAL OF ISLAMIC AND MIDDLE EASTERN FINANCE AND MANAGEMENT,2018,2018,11,4,,,,553,574,,10.1108/IMEFM-06-2017-0153,,,2,0.67,0,0,0,0,0,0,0,0,0,0,0,0,0,0,0,0,0,0,0,0,0,0,0,0,0,0,0,0,0,0,0,0,0,0,2,0
Is there discrimination against the agricultural sector in the credit rationing behavior of commercial banks in Ghana?,"Sackey, Frank Gyimah",,,,AGRICULTURAL FINANCE REVIEW,2018,2018,78,3,,,,348,363,,10.1108/AFR-08-2017-0077,,,2,0.67,0,0,0,0,0,0,0,0,0,0,0,0,0,0,0,0,0,0,0,0,0,0,0,0,0,0,0,0,0,0,0,0,0,0,2,0
Female CFOs and loan contracting: Financial conservatism or gender discrimination? - An empirical test based on collateral clauses,"Xu, Xixiong; Li, Yaoqin; Chang, Mengmeng",,,,CHINA JOURNAL OF ACCOUNTING RESEARCH,JUN 2016,2016,9,2,,,,153,173,,10.1016/j.cjar.2015.10.001,,,2,0.4,0,0,0,0,0,0,0,0,0,0,0,0,0,0,0,0,0,0,0,0,0,0,0,0,0,0,0,0,0,0,0,0,0,2,0,0
The value of partial state ownership in publicly listed private sector enterprises: evidence from China,"Song, Zengji; Nahm, Abraham; Zhang, Zongyi",,,,POST-COMMUNIST ECONOMIES,JUL 3 2015,2015,27,3,,,,336,353,,10.1080/14631377.2015.1055967,,,2,0.33,0,0,0,0,0,0,0,0,0,0,0,0,0,0,0,0,0,0,0,0,0,0,0,0,0,0,0,0,0,0,0,0,2,0,0,0
Women's Access to Credit: Asian Women's Double Burden,"Lee, Jonghee",,,,ASIAN WOMEN,SUM 2013,2013,29,2,,,,49,81,,,,,2,0.25,0,0,0,0,0,0,0,0,0,0,0,0,0,0,0,0,0,0,0,0,0,0,0,0,0,0,0,0,0,0,1,0,0,0,1,0
Determinants of housing loan patterns toward minority borrowers in Mississippi,"Ezeala-Harrison, Fidel; Glover, Glenda B.",,,,JOURNAL OF ECONOMIC ISSUES,MAR 2008,2008,42,1,,,,75,96,,10.1080/00213624.2008.11507115,,,2,0.15,0,0,0,0,0,0,0,0,0,0,0,0,0,0,0,0,0,0,0,0,0,0,0,0,1,0,0,0,1,0,0,0,0,0,0,0
Financial inclusion and poverty: a tale of forty-five thousand households,"Churchill, Sefa Awaworyi; Marisetty, Vijaya Bhaskar",,,,APPLIED ECONOMICS,,2019,,,,,,,,,10.1080/00036846.2019.1678732,,,1,0.5,0,0,0,0,0,0,0,0,0,0,0,0,0,0,0,0,0,0,0,0,0,0,0,0,0,0,0,0,0,0,0,0,0,0,0,1
Loan financing and investment in princeling-backed firms,"Li, Qing; Liu, Qigui; Ma, Shiguang; Tian, Gary Gang",,,,PACIFIC-BASIN FINANCE JOURNAL,SEP 2019,2019,56,,,,,71,92,,10.1016/j.pacfin.2019.05.009,,,1,0.5,0,0,0,0,0,0,0,0,0,0,0,0,0,0,0,0,0,0,0,0,0,0,0,0,0,0,0,0,0,0,0,0,0,0,1,0
Does land titling improve credit access? Quasi-experimental evidence from rural China,"Zhang, Longyao; Cheng, Wenli; Cheng, Enjiang; Wu, Bi",,,,APPLIED ECONOMICS,JAN 8 2020,2020,52,2,,,,227,241,,10.1080/00036846.2019.1644446,,,1,0.5,0,0,0,0,0,0,0,0,0,0,0,0,0,0,0,0,0,0,0,0,0,0,0,0,0,0,0,0,0,0,0,0,0,0,1,0
Heterogeneous effects of credit constraints on SMEs' employment: Evidence from the European sovereign debt crisis,"Cornille, David; Rycx, Francois; Tojerow, Ilan",,,,JOURNAL OF FINANCIAL STABILITY,APR 2019,2019,41,,,,,1,13,,10.1016/j.jfs.2019.02.001,,,1,0.5,0,0,0,0,0,0,0,0,0,0,0,0,0,0,0,0,0,0,0,0,0,0,0,0,0,0,0,0,0,0,0,0,0,0,1,0
Credit Rationing in Small and Micro Enterprises: A Theoretical Analysis,"Jin, Yuhuan; Zhang, Sheng",,,,SUSTAINABILITY,MAR 1 2019,2019,11,5,,,,,,1330,10.3390/su11051330,,,1,0.5,0,0,0,0,0,0,0,0,0,0,0,0,0,0,0,0,0,0,0,0,0,0,0,0,0,0,0,0,0,0,0,0,0,0,1,0
Determinants of credit risk in the banking system in Sub-Saharan Africa,"Mpofu, Trust R.; Nikolaidou, Eftychia",,,,REVIEW OF DEVELOPMENT FINANCE,DEC 2018,2018,8,2,,,,141,153,,10.1016/j.rdf.2018.08.001,,,1,0.33,0,0,0,0,0,0,0,0,0,0,0,0,0,0,0,0,0,0,0,0,0,0,0,0,0,0,0,0,0,0,0,0,0,0,1,0
Determinants of the Financing Obstacles Faced by SMEs An Empirical Study of Emerging Economies,"Nizaeva, Mirgul; Coskun, Ali",,,,JOURNAL OF ECONOMIC AND SOCIAL STUDIES,FAL 2018,2018,7,2,,,,81,99,,10.14706/JECOSS17725,,,1,0.33,0,0,0,0,0,0,0,0,0,0,0,0,0,0,0,0,0,0,0,0,0,0,0,0,0,0,0,0,0,0,0,0,0,0,1,0
Double bind in loan access in China: the reification of gender differences in business loans,"Xu, Huacen (Brin); Zhan, Heying Jenny; James, Claire Elizabeth-Ellen; Fannin, Lauren Denise; Yin, Yue",,,,INTERNATIONAL JOURNAL OF GENDER AND ENTREPRENEURSHIP,2018,2018,10,3,,,,182,197,,10.1108/IJGE-08-2017-0048,,,1,0.33,0,0,0,0,0,0,0,0,0,0,0,0,0,0,0,0,0,0,0,0,0,0,0,0,0,0,0,0,0,0,0,0,0,0,1,0
The Urban-Rural Gap of Chinese Household Finance,"Sui, Yubing; Niu, Geng",,,,EMERGING MARKETS FINANCE AND TRADE,2018,2018,54,2,,,,377,392,,10.1080/1540496X.2017.1367660,,,1,0.33,0,0,0,0,0,0,0,0,0,0,0,0,0,0,0,0,0,0,0,0,0,0,0,0,0,0,0,0,0,0,0,0,0,0,1,0
Financial Inclusion in China: Use of Credit,"Chen, Zibei; Jin, Minchao",,,,JOURNAL OF FAMILY AND ECONOMIC ISSUES,DEC 2017,2017,38,4,,,,528,540,,10.1007/s10834-017-9531-x,,,1,0.25,0,0,0,0,0,0,0,0,0,0,0,0,0,0,0,0,0,0,0,0,0,0,0,0,0,0,0,0,0,0,0,0,0,0,1,0
Financial intermediation and financial inclusion of poor households: Mediating role of social networks in rural Uganda,"Bongomin, George Okello Candiya; Ntayi, Joseph Mpeera; Munene, John C.; Akol, Charles Malinga",,,,COGENT ECONOMICS & FINANCE,AUG 29 2017,2017,5,1,,,,,,1362184,10.1080/23322039.2017.1362184,,,1,0.25,0,0,0,0,0,0,0,0,0,0,0,0,0,0,0,0,0,0,0,0,0,0,0,0,0,0,0,0,0,0,0,0,0,0,1,0
Analysis on determinants of rural household credit in China,"Cui, Yanjuan; Sun, Gang; Siddik, Md. Nur Alam; Liu, Xuejing",,,,JOURNAL OF INTERDISCIPLINARY MATHEMATICS,2017,2017,20,5,,,,1179,1201,,10.1080/09720502.2017.1334361,,,1,0.25,0,0,0,0,0,0,0,0,0,0,0,0,0,0,0,0,0,0,0,0,0,0,0,0,0,0,0,0,0,0,0,0,0,0,1,0
Financial inclusion in Colombia: A scoping literature review,"Thoene, Ulf; Turriago-Hoyos, Alvaro",,,,INTANGIBLE CAPITAL,2017,2017,13,3,,,,582,614,,10.3926/ic.946,,,1,0.25,0,0,0,0,0,0,0,0,0,0,0,0,0,0,0,0,0,0,0,0,0,0,0,0,0,0,0,0,0,0,0,0,0,0,1,0
Determinants of Credit Rationing in Ethiopia: Firm-Level Evidence,"Bedane, Bizuayehu",,,,ECONOMICS BULLETIN,2016,2016,36,4,,,,2161,+,,,,,1,0.2,0,0,0,0,0,0,0,0,0,0,0,0,0,0,0,0,0,0,0,0,0,0,0,0,0,0,0,0,0,0,0,0,0,0,1,0
Bank Credit Access and Gender Discrimination: Some Stylized Facts,"Galli, Emma; Rossi, Stefania P. S.",,,"Rossi, SPS; Malavasi, R","FINANCIAL CRISIS, BANK BEHAVIOUR AND CREDIT CRUNCH",2016,2016,,,,,,111,123,,10.1007/978-3-319-17413-6_8,International Workshop on Financial Crisis and Credit Crunch - Micro and Macroeconomic Implications,"JUL 04, 2014",1,0.2,0,0,0,0,0,0,0,0,0,0,0,0,0,0,0,0,0,0,0,0,0,0,0,0,0,0,0,0,0,0,0,0,1,0,0,0
Gender and Economic Development in Africa: An Overview,"Manda, Damiano K.; Mwakubo, Samuel",,,,JOURNAL OF AFRICAN ECONOMIES,JAN 2014,2014,23,,,1,,I4,I17,,10.1093/jae/ejt021,,,1,0.14,0,0,0,0,0,0,0,0,0,0,0,0,0,0,0,0,0,0,0,0,0,0,0,0,0,0,0,0,0,0,0,0,0,1,0,0
Characteristics of Rural Credit Market in China Based on Household Economic,"Zhou, Zongfang; Li, Yongkui; Lv, Gang; Wang, Jing",,,"Zhao, S; Wang, J",REGIONAL DEVELOPMENT AND RISK MANAGEMENT IN THE WEST OF CHINA,2012,2012,,,,,,12,18,,,Symposium on Regional Development and Risk Management in the West of China,"NOV 05-06, 2011",1,0.11,0,0,0,0,0,0,0,0,0,0,0,0,0,0,0,0,0,0,0,0,0,0,0,0,0,0,0,0,1,0,0,0,0,0,0,0
Racial Disparities in Credit Constraints in the Great Recession: Evidence from the UK,"Gathergood, John",,,,B E JOURNAL OF ECONOMIC ANALYSIS & POLICY,2011,2011,11,1,,,,,,61,,,,1,0.1,0,0,0,0,0,0,0,0,0,0,0,0,0,0,0,0,0,0,0,0,0,0,0,0,0,0,0,0,0,0,0,0,1,0,0,0
Racial and gender disadvantage in the credit market: Social injustice and outcome equality,"Dymski, GA",,,"Pollin, R","CAPITALISM, SOCIALISM AND RADICAL POLITICAL ECONOMY: ESSAYS IN HONOR OF HOWARD J. SHERMAN",2000,2000,1,,,,,227,246,,,"Conference on Capitalism, Socialism, and Radical Political Economy","FEB 12-13, 1999",1,0.05,0,0,0,0,0,0,0,0,0,0,0,0,0,0,0,0,0,0,0,0,0,1,0,0,0,0,0,0,0,0,0,0,0,0,0,0
Bank credit constraints for women-led SMEs: Self-restraint or lender bias?,"Galli, Emma; Mascia, Danilo, V; Rossi, Stefania P. S.",,,,EUROPEAN FINANCIAL MANAGEMENT,,2020,,,,,,,,,10.1111/eufm.12255,,,0,0,0,0,0,0,0,0,0,0,0,0,0,0,0,0,0,0,0,0,0,0,0,0,0,0,0,0,0,0,0,0,0,0,0,0,0,0
Access to Credit and Economic Well-Being of Rural Households: Evidence from Eastern India,"Kumar, Anjani; Mishra, Ashok K.; Sonkar, Vinay K.; Saroj, Sunil",,,,JOURNAL OF AGRICULTURAL AND RESOURCE ECONOMICS,JAN 2020,2020,45,1,,,,145,160,,10.22004/ag.econ.298439,,,0,0,0,0,0,0,0,0,0,0,0,0,0,0,0,0,0,0,0,0,0,0,0,0,0,0,0,0,0,0,0,0,0,0,0,0,0,0
Gender differences in the repayment of microcredit: The mediating role of trustworthiness,"Shahriar, Abu Zafar M.; Unda, Luisa A.; Alam, Quamrul",,,,JOURNAL OF BANKING & FINANCE,JAN 2020,2020,110,,,,,,,105685,10.1016/j.jbankfin.2019.105685,,,0,0,0,0,0,0,0,0,0,0,0,0,0,0,0,0,0,0,0,0,0,0,0,0,0,0,0,0,0,0,0,0,0,0,0,0,0,0
"Determinants of credit demand of farmers in Lam Dong, Vietnam A comparison of machine learning and multinomial logit",Huy Duc Dang; Au Hai Thi Dam; Thuyen Thi Pham; Tra My Thi Nguyen,,,,AGRICULTURAL FINANCE REVIEW,,2019,,,,,,,,,10.1108/AFR-06-2019-0061,,,0,0,0,0,0,0,0,0,0,0,0,0,0,0,0,0,0,0,0,0,0,0,0,0,0,0,0,0,0,0,0,0,0,0,0,0,0,0
The decreasing value of non-SOEs' political connections during China's anti-corruption campaign: evidence and mechanism,"Liu, Jinsong; Ying, Qianwei",,,,ACCOUNTING AND FINANCE,DEC 2019,2019,59,5,,,,3171,3221,,10.1111/acfi.12582,,,0,0,0,0,0,0,0,0,0,0,0,0,0,0,0,0,0,0,0,0,0,0,0,0,0,0,0,0,0,0,0,0,0,0,0,0,0,0
"Bringing religion back in Religious entrepreneurs, entrepreneurial gender, and bank loans in Chinese family firms","Du, Xingqiang; Zeng, Quan",,,,ASIAN REVIEW OF ACCOUNTING,DEC 2 2019,2019,27,4,,,,508,545,,10.1108/ARA-04-2018-0097,,,0,0,0,0,0,0,0,0,0,0,0,0,0,0,0,0,0,0,0,0,0,0,0,0,0,0,0,0,0,0,0,0,0,0,0,0,0,0
"China's anti-corruption campaign, political connections and private firms' debt financing","Hu, Yiming; Xu, Mingxia",,,,CHINA FINANCE REVIEW INTERNATIONAL,NOV 18 2019,2019,9,4,,,,521,553,,10.1108/CFRI-09-2018-0132,,,0,0,0,0,0,0,0,0,0,0,0,0,0,0,0,0,0,0,0,0,0,0,0,0,0,0,0,0,0,0,0,0,0,0,0,0,0,0
"Microfinance, financial inclusion and ICT: Implications for poverty and inequality","Mushtaq, Rizwan; Bruneau, Catherine",,,,TECHNOLOGY IN SOCIETY,NOV 2019,2019,59,,,,,,,101154,10.1016/j.techsoc.2019.101154,,,0,0,0,0,0,0,0,0,0,0,0,0,0,0,0,0,0,0,0,0,0,0,0,0,0,0,0,0,0,0,0,0,0,0,0,0,0,0
Female financial inclusion and its impacts on inclusive economic development,"Cabeza-Garcia, Laura; Del Brio, Esther B.; Luz Oscanoa-Vittorio, Mery",,,,WOMENS STUDIES INTERNATIONAL FORUM,NOV-DEC 2019,2019,77,,,,,,,102300,10.1016/j.wsif.2019.102300,,,0,0,0,0,0,0,0,0,0,0,0,0,0,0,0,0,0,0,0,0,0,0,0,0,0,0,0,0,0,0,0,0,0,0,0,0,0,0
Political connections and corporate performance: Evidence from Pakistan,"Saeed, Abubakr; Belghitar, Yacine; Clark, Ephraim",,,,ECONOMICS OF TRANSITION,OCT 2019,2019,27,4,,,,863,889,,10.1111/ecot.12213,,,0,0,0,0,0,0,0,0,0,0,0,0,0,0,0,0,0,0,0,0,0,0,0,0,0,0,0,0,0,0,0,0,0,0,0,0,0,0
Social ties between SME managers and bank employees: Financial consequences vs. SME managers' perceptions,"Jackowicz, Krzysztof; Kozlowski, Lukasz",,,,EMERGING MARKETS REVIEW,SEP 2019,2019,40,,,,,,,UNSP 100619,10.1016/j.ememar.2019.05.004,,,0,0,0,0,0,0,0,0,0,0,0,0,0,0,0,0,0,0,0,0,0,0,0,0,0,0,0,0,0,0,0,0,0,0,0,0,0,0
Dual Credit Markets and Household Usage to Finance: Evidence from a Representative Chinese Household Survey,"Cull, Robert; Gan, Li; Gao, Nan; Xu, Lixin Colin",,,,OXFORD BULLETIN OF ECONOMICS AND STATISTICS,DEC 2019,2019,81,6,,,,1280,1317,,10.1111/obes.12320,,,0,0,0,0,0,0,0,0,0,0,0,0,0,0,0,0,0,0,0,0,0,0,0,0,0,0,0,0,0,0,0,0,0,0,0,0,0,0
Bridging the credit gap for sustainable medicinal plant value chain development in Northwestern Vietnam,"Luan, Do Xuan",,,,AGRICULTURAL FINANCE REVIEW,AUG 5 2019,2019,79,4,,,,443,466,,10.1108/AFR-07-2018-0061,,,0,0,0,0,0,0,0,0,0,0,0,0,0,0,0,0,0,0,0,0,0,0,0,0,0,0,0,0,0,0,0,0,0,0,0,0,0,0
The interaction effect of gender and ethnicity in loan approval: A Bayesian estimation with data from a laboratory field experiment,"Gonzales Martinez, Rolando; Aguilera-Lizarazu, Gabriela; Rojas-Hosse, Andrea; Aranda Blanco, Patricia",,,,REVIEW OF DEVELOPMENT ECONOMICS,,2019,,,,,,,,,10.1111/rode.12607,,,0,0,0,0,0,0,0,0,0,0,0,0,0,0,0,0,0,0,0,0,0,0,0,0,0,0,0,0,0,0,0,0,0,0,0,0,0,0
What restricts credit to women enterprises? Evidence from India's informal sector,"Maurya, Prateeksha; Mohanty, Pratap Chandra",,,,INTERNATIONAL JOURNAL OF SOCIAL ECONOMICS,JUL 8 2019,2019,46,7,,,,920,937,,10.1108/IJSE-08-2018-0422,,,0,0,0,0,0,0,0,0,0,0,0,0,0,0,0,0,0,0,0,0,0,0,0,0,0,0,0,0,0,0,0,0,0,0,0,0,0,0
SME credit constraints in Asia's rising economic star: fresh empirical evidence from Vietnam,"Lan Thanh Nguyen; Su, Jen-Je; Sharma, Parmendra",,,,APPLIED ECONOMICS,JUN 21 2019,2019,51,29,,,,3170,3183,,10.1080/00036846.2019.1569196,,,0,0,0,0,0,0,0,0,0,0,0,0,0,0,0,0,0,0,0,0,0,0,0,0,0,0,0,0,0,0,0,0,0,0,0,0,0,0
The value of political connections in opaque firms: Evidence from China's file 18,"Hu, Yi; Wang, Changyun; Xiao, Gang; Zeng, Jianyu",,,,PACIFIC-BASIN FINANCE JOURNAL,JUN 2019,2019,55,,,,,329,351,,10.1016/j.pacfin.2019.05.001,,,0,0,0,0,0,0,0,0,0,0,0,0,0,0,0,0,0,0,0,0,0,0,0,0,0,0,0,0,0,0,0,0,0,0,0,0,0,0
Social networks and informal financial inclusion in China,"Chai, Shijun; Chen, Yang; Huang, Bihong; Ye, Dezhu",,,,ASIA PACIFIC JOURNAL OF MANAGEMENT,JUN 2019,2019,36,2,,,SI,529,563,,10.1007/s10490-017-9557-5,,,0,0,0,0,0,0,0,0,0,0,0,0,0,0,0,0,0,0,0,0,0,0,0,0,0,0,0,0,0,0,0,0,0,0,0,0,0,0
Financial inclusion as a pathway to welfare enhancement and income equality: Micro-level evidence from Nigeria,"Ibrahim, Saifullahi Sani; Ozdeser, Huseyin; Cavusoglu, Behiye",,,,DEVELOPMENT SOUTHERN AFRICA,MAY 4 2019,2019,36,3,,,,390,407,,10.1080/0376835X.2018.1498766,,,0,0,0,0,0,0,0,0,0,0,0,0,0,0,0,0,0,0,0,0,0,0,0,0,0,0,0,0,0,0,0,0,0,0,0,0,0,0
Determinants of credit rationing among rural farmers in developing areas Empirical evidence based on micro level data,"Kofarmata, Yusuf Ibrahim; Danlami, Abubakar Hamid",,,,AGRICULTURAL FINANCE REVIEW,APR 1 2019,2019,79,2,,,,158,173,,10.1108/AFR-03-2018-0023,,,0,0,0,0,0,0,0,0,0,0,0,0,0,0,0,0,0,0,0,0,0,0,0,0,0,0,0,0,0,0,0,0,0,0,0,0,0,0
Does connectedness improve SMEs' access to formal finance? Evidence from post-communist economies,"Ruziev, Kobil; Webber, Don J.",,,,POST-COMMUNIST ECONOMIES,MAR 4 2019,2019,31,2,,,,258,278,,10.1080/14631377.2018.1470855,,,0,0,0,0,0,0,0,0,0,0,0,0,0,0,0,0,0,0,0,0,0,0,0,0,0,0,0,0,0,0,0,0,0,0,0,0,0,0
The Impact of the Anti-Corruption Campaign on the Relationship Between Political Connections and Preferential Bank Loans: The Case of China,"Guo, Chan",,,,EMERGING MARKETS FINANCE AND TRADE,FEB 19 2019,2019,55,3,,,,671,686,,10.1080/1540496X.2018.1454306,,,0,0,0,0,0,0,0,0,0,0,0,0,0,0,0,0,0,0,0,0,0,0,0,0,0,0,0,0,0,0,0,0,0,0,0,0,0,0
"Political connections, government capital injection, and deposit insurance premium","Lin, Jyh-Horng; Chen, Shi; Huang, Fu-Wei",,,,INTERNATIONAL JOURNAL OF MANAGERIAL FINANCE,FEB 4 2019,2019,15,1,,,,2,18,,10.1108/IJMF-12-2017-0271,,,0,0,0,0,0,0,0,0,0,0,0,0,0,0,0,0,0,0,0,0,0,0,0,0,0,0,0,0,0,0,0,0,0,0,0,0,0,0
FEMALE BORROWERS AND CREDIT CONSTRAINTS IN SME LOAN MARKET: AN ANALYSES FROM THE VISEGRAD COUNTRIES,"Rahman, A.; Zbrankova, H.",,,,POLISH JOURNAL OF MANAGEMENT STUDIES,2019,2019,20,2,,,,426,440,,10.17512/pjms.2019.20.2.36,,,0,0,0,0,0,0,0,0,0,0,0,0,0,0,0,0,0,0,0,0,0,0,0,0,0,0,0,0,0,0,0,0,0,0,0,0,0,0
Gender Gap in case of Financial Inclusion: An Empirical Analysis in Indian Context,"Ghosh, Chandralekha; Chaudhury, Rimita Hom",,,,ECONOMICS BULLETIN,2019,2019,39,4,,,,2615,2630,,,,,0,0,0,0,0,0,0,0,0,0,0,0,0,0,0,0,0,0,0,0,0,0,0,0,0,0,0,0,0,0,0,0,0,0,0,0,0,0
"Determinants of financial inclusions: comparing high, middle, and low-income countries","Chu, Lan Khanh",,,,ECONOMICS BULLETIN,2019,2019,39,2,,,,1449,+,,,,,0,0,0,0,0,0,0,0,0,0,0,0,0,0,0,0,0,0,0,0,0,0,0,0,0,0,0,0,0,0,0,0,0,0,0,0,0,0
Credit access and performance of Italian firms: how relevant is gender?,"Serino, Luana; Papa, Armando; Campanella, Francesco; Mueller, Jens",,,,INTERNATIONAL JOURNAL OF MANAGERIAL AND FINANCIAL ACCOUNTING,2019,2019,11,3-4,,,,269,289,,,,,0,0,0,0,0,0,0,0,0,0,0,0,0,0,0,0,0,0,0,0,0,0,0,0,0,0,0,0,0,0,0,0,0,0,0,0,0,0
Entrepreneurial Borrowing: Do Entrepreneurs Seek and Receive Enough Credit?,"Fraser, Stuart",,,,FOUNDATIONS AND TRENDS IN ENTREPRENEURSHIP,2019,2019,15,5-6,,,,431,663,,10.1561/0300000076,,,0,0,0,0,0,0,0,0,0,0,0,0,0,0,0,0,0,0,0,0,0,0,0,0,0,0,0,0,0,0,0,0,0,0,0,0,0,0
Econometric analysis of political connection affect corporate credit financing constraints based on fuzzy logic and SEM model,Tian Xueying; Nie Panke,,,,JOURNAL OF INTELLIGENT & FUZZY SYSTEMS,2019,2019,37,1,,,,441,454,,10.3233/JIFS-179099,,,0,0,0,0,0,0,0,0,0,0,0,0,0,0,0,0,0,0,0,0,0,0,0,0,0,0,0,0,0,0,0,0,0,0,0,0,0,0
FORMAL CREDIT INCLUSION WITHIN ONE-COMMUNE-ONE-PRODUCT (OCOP) IN THE AGRICULTURAL RESTRUCTURING STRATEGY OF NORTHWESTERN VIETNAM,Do Xuan Luan; Diep Thanh Tung,,,,ECONOMICS & SOCIOLOGY,2019,2019,12,2,,,,94,108,,10.14254/2071-789X.2019/12-2/6,,,0,0,0,0,0,0,0,0,0,0,0,0,0,0,0,0,0,0,0,0,0,0,0,0,0,0,0,0,0,0,0,0,0,0,0,0,0,0
"Gendered Paths to Asset Accumulation? Markets, Savings, and Credit in Developing Countries","Doss, Cheryl R.; Deere, Carmen Diana; Oduro, Abena D.; Swaminathan, Hema; Catanzarite, Zachary; Suchitra, J. Y.",,,,FEMINIST ECONOMICS,2019,2019,25,2,,,,36,66,,10.1080/13545701.2019.1566753,,,0,0,0,0,0,0,0,0,0,0,0,0,0,0,0,0,0,0,0,0,0,0,0,0,0,0,0,0,0,0,0,0,0,0,0,0,0,0
Political Connections and Corporate Borrowing: an Analysis on the Listed Real Estate Firms in China,"Yang, Zan; Fan, Ying; Shi, Song; Liao, Jing",,,,JOURNAL OF REAL ESTATE FINANCE AND ECONOMICS,OCT 2018,2018,57,3,,,,315,350,,10.1007/s11146-017-9629-9,,,0,0,0,0,0,0,0,0,0,0,0,0,0,0,0,0,0,0,0,0,0,0,0,0,0,0,0,0,0,0,0,0,0,0,0,0,0,0
Gender discrimination in access to credit: are women-led SMEs rejected more than men-led?,"Long Hoang Le; Stefanczyk, Joanna Katarzyna",,,,GENDER TECHNOLOGY & DEVELOPMENT,2018,2018,22,2,,,,145,163,,10.1080/09718524.2018.1506973,,,0,0,0,0,0,0,0,0,0,0,0,0,0,0,0,0,0,0,0,0,0,0,0,0,0,0,0,0,0,0,0,0,0,0,0,0,0,0
Evaluating credit accessibility predictors among small and medium contractors in the South African construction industry,"Balogun, Olanrewaju; Agumba, Justus; Ansary, Nazeem",,,,ACTA STRUCTILIA,2018,2018,25,2,,,,69,93,,10.18820/8820/24150487/as25i2.3,,,0,0,0,0,0,0,0,0,0,0,0,0,0,0,0,0,0,0,0,0,0,0,0,0,0,0,0,0,0,0,0,0,0,0,0,0,0,0
"Culture, Ethnicity and Access to Bank Credit","Mishra, Onkar Nath; Tripathi, P. S.",,,,GLOBAL BUSINESS REVIEW,DEC 2017,2017,18,6,,,,1552,1567,,10.1177/0972150917713077,,,0,0,0,0,0,0,0,0,0,0,0,0,0,0,0,0,0,0,0,0,0,0,0,0,0,0,0,0,0,0,0,0,0,0,0,0,0,0
"Addressing Poverty and Gender Inequality through Access to Formal Credit and Enhanced Enterprise Performance in Nigeria: An Empirical Investigation (vol 29, pg 56, 2017)","Nwosu, E. O.; Orji, A.",,,,AFRICAN DEVELOPMENT REVIEW-REVUE AFRICAINE DE DEVELOPPEMENT,DEC 2017,2017,29,4,,,,691,691,,10.1111/1467-8268.12307,,,0,0,0,0,0,0,0,0,0,0,0,0,0,0,0,0,0,0,0,0,0,0,0,0,0,0,0,0,0,0,0,0,0,0,0,0,0,0
DETERMINANTS OF CREDIT TO SMES - EMPIRICAL EVIDENCE FROM SUPPLY SIDE PERSPECTIVE IN MUMBAI REGION,"Raghu, Kumari P. S.; Pankaj, Trivedi",,,"Vrontis, D; Weber, Y; Tsoukatos, E",GLOBAL AND NATIONAL BUSINESS THEORIES AND PRACTICE: BRIDGING THE PAST WITH THE FUTURE,2017,2017,,,,,,2285,2286,,,10th Annual Conference of the EuroMed-Academy-of-Business,"SEP 13-15, 2017",0,0,0,0,0,0,0,0,0,0,0,0,0,0,0,0,0,0,0,0,0,0,0,0,0,0,0,0,0,0,0,0,0,0,0,0,0,0
